Speaker,Time,Date,Duration,Statement,Region,High Contracting Party
UNITED STATES,15:21:08,2024-03-06,0:00:20,"Thank you for breaking the ice . With apologies , if it is okay , we would return to topic 2 and do an intervention on that . So apologies for not breaking the ice on chapter 3 . But with your indulgence , before that conversation started , we were hoping just to come back on question 2 , topic 2 , if we may .",Western European and other States,Yes
UNITED STATES,15:21:52,2024-03-06,0:12:25,"So this is still for the list on topic 2 . You have the floor . Thank you . Thank you much , Mr. Chair . So just some reactions just with regard to the specific text and bullets and really appreciating the very good discussion we have had so far on it . So just with regard to the chapeau language about the legality of laws depends on , I think our suggestion would be to really flesh this out a little bit and instead refer to the legality of the use of laws to conduct a tax . And we see this as consistent with our general remarks that what we are doing in this question is addressing the use and the legality of the use of laws . And then we think it would be useful to refer to a tax in line with the specific IHL rules that are applicable to a tax that the group has found consensus on , distinction , proportionality , precautions in a tax . So wanted to provide a few concrete text ideas about how we can focus and take our discussion forward . Just with regard to the the first bullet , use and or functioning operational environment and nature of targets , I think as other Delegations have noted , these are factors that may be relevant and under legal requirements , they are practical and important considerations , but we do not see these as independent legal criteria or legal rules . A very similar comment with regard to the next bullet in a specific context , of course , we very much agree with the good discussion and many other Delegations that have raised the point that specific context is relevant to the application of IHL rules . However , I think we would note that we do not think it would be fruitful to try to elaborate different categories of context in which laws may be used or not used . With regard to the next bullet , human control involvement supervision , I think here we would note that we have already negotiated language on human machine interaction and a great deal of good consensus work has been done on that . As we stated before , the US Delegation does not support characterizing human control as a requirement of IHL . It is a means , it is one means , an important means , but not the only means that can enable compliance with IHL . Also see as a way out of some of this language , I wanted to appreciate the suggestion from Australian colleagues about the GGE already having reached consensus on the concept of operating systems within a responsible chain of human command and control . Of course , there is the language on control that I think you noted with regard to the 2023 GGE report . With regard to the next bullet , throughout the life cycle of laws , et cetera , I think the general comment we wanted to make here was a desire to move our conversation towards greater specificity and enabling more effective implementation of the various measures that will be a part of our instrument . We already have broad language about the importance of human machine interaction throughout the life cycle . Rather than renegotiating that guiding principle , we think we should be focusing on what requirements at particular stages of the life cycle can be taken or what practices can be taken at the various stages in support of the effective implementation of the legal requirements during use . Of course , use is where IHL applies to the conduct of hostilities , to the use of the weapons , but it is an important insight that the GGE has already reached that measures at various stages contribute to effective implementation and compliance with IHL during the use stage . In our draft articles proposal that we have put forward and other Delegations have supported , we articulate measures during development that can contribute to , for example , reducing the risk to civilians . With regard to the next bullet about the human operator beginning to articulate a number of subpoints about imposing limits , of course , as a general point , we want to recall that we do not see this bullet as a requirement of IHL specifically . This is not an IHL rule , but more practical consideration that helps implement IHL rules . We also wanted to make a factual point here that when we are talking about limitations regarding space and time or the types of targets and the duration of operation , geographic scope and scale of use , these will not necessarily be things that the operator does . How long the system operates or what types of targets it can engage , these are factors that will be potentially set during the development of the weapons system rather than things that the operator of the weapons system will be able to manipulate . So we did want to also bring that practical consideration into the conversation here . With regard to the next bullet , too , predict , trace and explain the behavior of laws , again , it does not reflect existing IHL and we support further work to try and explain how these concepts relate to specific IHL rules . For example , the principle of proportionality requires an expectation of the risks of civilian harm . That is that risk of civilian harm is what we are trying to predict , not abstractly the behavior of the weapons system . So wanting to evolve and focus our work on this particular bullet , the same comment , I think , with regard to the next bullet , we are talking generally about information . We want to progress our understanding and our measures and talk specifically about what kind of information is useful to conduct proportionality assessments to fulfill those IHL requirements , for example . And then lastly , with regard to changing the mode of the operation including deactivation , I just would recall the general point in our intervention that this could be usefully under the rubric of feasible precautions and that might be a way to conceptualize this particular practice and then also build out other important practices that could be part of our instrument . Lastly , we wanted to comment on this last bullet about reliance on transfunctions must be in good faith and consistent with due diligence . In particular , we wanted to appreciate the question from our ICRAC colleagues about this language about good faith and where it comes from . So really wanted to respond to that question . You know , for us , for the US , we believe that the law of war requires that all decision making in armed conflict in the implementation of IHL rules must be undertaken in good faith on the basis of the available information . And we see this as reflection of broader principle in customary international law that good faith performance of legal obligations is sort of foundational to the implementation of legal obligations . The principle of good faith is recognized in the Vienna Convention on the law of treaties . We believe that it also applies to the implementation of IHL and every member of the armed forces , you know , for example , in our view has a duty to comply with IHL in good faith . We would also recall that the GGE found consensus on this concept of good faith in 2019 . In the 2019 report , paragraph 17H , talking about how IHL compliance requires that human beings make certain judgments in good faith based on their assessment of the information available to them at the time . So we hope that is a useful explanation of where we see good faith and why we think it to be particularly relevant . And the other comment we would like to make with regard to this bullet is really just to connect it again to other IHL rules . And this is I think what we emphasized in our response to you , Mr. Chair , to this guiding question that the combatants' reliance on autonomous functions to identify , select or engage targets must be in good faith and in light of the information available at the time and must be consistent with due diligence in the implementation of the requirements and principles of distinction , proportionality and precautions in attack . And so we do want to connect the concept of good faith and due diligence to those specific IHL rules . And we think that is an important part of what we are trying to do here and this broader exercise of understanding how IHL applies to the use of autonomous weapon systems . And if you will bear with me , I will just try and explain it a little further . So from our perspective , IHL rules on the conduct of attacks like distinction apply to the commanders and operators , not the weapons . And that was a point we made earlier . It is not the weapon that was distinguished but the commander or the operator . With an autonomous weapon system , however , the commander and operator is relying on the weapon system to perform functions like selecting and engaging targets . And that reliance is I think what we are trying to highlight . IHL , of course , does not prohibit commanders and operators from using tools to assist them in combat . And so for us , an important legal question here is does the operator or commander's reliance on this tool , on the autonomous weapon system automating the target selection and engagement function , is that consistent with due diligence in the implementation of distinction ? Are they satisfying due diligence when relying on the weapon system to identify , select and engage the target ? And our draft article's proposal tries to specify some of the factors that are relevant to this analysis and we think this is an important area in which the GGE should do more work and could usefully do more work to strengthen the implementation of IHL . I thank you , Mr. Chair .",Western European and other States,Yes
AUSTRIA,15:34:45,2024-03-06,0:01:49,"We will give them the floor . Sir , you have the floor . On this topic again , we just wanted to react in the spirit of an interactive debate . It is mostly about the last point that was brought up about the good faith and due diligence . We believe it is an interesting topic and it is something that we could discuss , but in our understanding and this is maybe some of the questions that this raises , the implementation in good faith and due diligence is normally something that applies to states . We know it from outer space treaty , from experience I also know it from other ways how obligations of states could be implemented . If we push this and here again , I mean , in the shorter version it is not clear who should rely on this autonomous functions in good faith and consistent with due diligence . From how it is on the screen , it is not really clear who is the subject in this formulation . We would be hesitant to push these kind of obligations to commanders and soldiers in the field . We see this rather as a state obligation and it seems to be a general tendency in this topic to push we are doing it as well in our working paper . I am clearly aware of that . But we should not go beyond in pushing too much of these state obligations or responsibilities on the persons who actually have to handle these weapon systems . This could have a number of negative effects . It also could lead to military lack of effectiveness if the commanders or the operators will not use weapon systems because they are not clear how it works and how severe the obligations and consequences for them would be . But this is just a side note . Thank you . I would like to thank you for your reaction .",Western European and other States,Yes
AUSTRALIA,15:36:42,2024-03-06,0:06:33,"With your indulgence , Chair , we would also like to return to the second part of topic 2 . We would as a preliminary comment echo the point made by several other Delegations that is helpful to be clear about the task we are engaging in under topic 2 . We see this as an exercise in clarifying how existing prohibitions and limitations under IHL apply to laws . We see this as critical work that needs to be done before any new additional measures might be considered . Chair , in part 1 of topic 2 we spoke about laws that are inherently incapable of being used in compliance with IHL . We understand that here in part 2 of topic 2 we are focused on weapon systems that do not fall into this category . That is we are talking about weapon systems that are capable of being used in compliance with IHL . As has been noted , IHL imposes restrictions on the manner in which weapon systems are used . The cardinal principles of IHL are the principles of distinction , proportionality and precautions in attack . It is helpful to recall that the 2023 laws GGE report recognized that control with regard to laws is needed to uphold compliance with international law including IHL . In Australia's view , the types of control measures needed to ensure compliance with IHL in the use of laws will be context specific . The controls needed will depend on the capabilities and limitations of the weapon system , the nature of the targets and the operational environment . We also consider that an appropriate level of human involvement across the life cycle of a weapon system will be required to ensure compliance with IHL . The specific type of human machine interaction that might be required will be highly context specific . Responding now to a few specific elements in the text , as a general observation on the chapeau language , we do not believe the legality of the use of laws depends on all the factors listed here . We think it is important to differentiate requirements under IHL from additional practical measures that help implement IHL . We have a comment to make on bullet point 3 which refers to human control involvement and supervision . Here we would reiterate our position that the appropriate degree of human involvement is context dependent . Very different controls and levels of human involvement would be required in a static environment with no civilians or civilian objects present as opposed to a cluttered dynamic environment where there is a risk of civilian harm . Regarding bullet point 4 which refers to at various stages of the life cycle and throughout the life cycle , Australia favors a formulation of this bullet point that refers to relevant stages or various stages of the life cycle of the laws as is necessary to ensure that the use of laws is in compliance with IHL . Regarding the language further down which refers to predict , trace and explain the behavior of laws , we have a comment to make on the word predict . There are certainly questions regarding the level of predictability or reliability of a weapon system's effects that are required to ensure that a weapon system is capable of complying with IHL . While we recognize that IHL requires those who plan or decide upon an attack to anticipate certain effects , this may not necessarily require the operator being able to predict the behavior of laws in causing the anticipated effect . So we think this is an idea that needs some further consideration . Moving on to the notion that it is necessary to trace the behavior of laws , in our view this concept may be best addressed by only deploying and operating laws within a responsible chain of human command and control . We also think ideas about traceability that have been put forward by some Delegations could be helpfully addressed during our discussion on accountability . Turning now to the next bullet point which refers to informed decisions about the deployment and use of weapons , IHL clearly requires that those responsible for planning , deciding upon or executing attacks reach their decisions about deployment and use of weapon systems based on an assessment of all information available to them at the relevant time . We agree with the position put forward by ICRC that the commanders and planners will need to anticipate and assess in advance the lawfulness of all possible strikes by the laws and that this must include all reasonably foreseeable changes in circumstances . We consider this a normal part of military planning which requires anticipating possible changes to circumstances based on enemy actions or responses . Turning now to the bullet point which refers to the human operator being able to change the mode of operation including deactivation . Several Delegations in this GGE have put forward the idea that laws must be equipped with certain technical features for them to be compliant with IHL . We consider that certain features such as self - neutralization and self - deactivation may be necessary in some circumstances depending on the operational context and other control measures available such as the ability of a human operator to intervene , suspend or cancel an attack . We do not regard these features as being required by IHL in all circumstances . Thank you , Chair .",Western European and other States,Yes
MEXICO,15:44:40,2024-03-06,0:08:46,"Thank you very much , Chair . I am daring to speak first taking into account that I actually have to leave the room for a few moments later . So I would like to share with you my views on this particular issue . Now , this is an issue that the Mexican Delegation believes is very important because in order to effectively have effective regulations we have to really know what the risks are related incorporating autonomy into weapon systems . Now , Mexico looks at the issue of risks in a somewhat broader way than how you , Chair , reflected that in the list and I will try to move from a more general assessment to more specific comments . The first thing , of course , we would like to say once again that we have to look at the question of risks from a perspective of ethics . These are indeed machines that are taking decision on life and death . Autonomous weapon systems present serious ethical issues where there is a cognitive distance in space , time and understanding between the human decision of human beings and the use of arms and there is no moral barrier where there is a transfer from responsibility in decisions to machines . Second , and we are repeating something that we already said in our general comments , the risks have to be also looked at from a security point of view . Lethal autonomous weapon systems present the risks of asymmetric wars , disproportionate use of force , unintentional conflicts , escalation of conflicts , generates an arms race and also they can start interacting with other weapon systems including WMD , third point or third category of risks . These are related to the situation when laws are being developed , when they are not placed under meaningful human control so they are not in a position to comply with IHL or other existing legal standards due to their nature or the way they operate . In this aspect we believe that the following risks arise . The first , the risks of excluding human control , especially when it relates to technical requirements for the operation of lethal weapons systems through preprogrammed profiles , information on the environment through sensors analysis of the information being collected by sensors and applied through the existing or preexisting profiles . Mexico believes that such processes cannot replace human judgment required to implement the fundamental principles of IHL in specific contexts . Also , there are risks related to such contexts . IHL and their legal obligations under international law depend on decisions that are aware of the context and can adapt to changing circumstances . Autonomy represents risks where the specific context is not really known . Space and time are also not processed correctly when these weapons are used . Then also there are risks related to the predictability of the effects of laws related to the attempts of users to limit the way these machines are used in line with IHL for risks of intentionality . Laws can simply go beyond what humans are capable to process . There is a risk to presume their capacity to recognize the context and also to adapt in a predictable manner to new situations that were not planned during the design phase or during the evaluation phase . Number 5 , risks relate to the human machine team . When we appreciate the need for human participation in the critical functions of machines , algorithms are extremely powerful to process extremely high levels of information , but this does not mean that they will carry out the correct causal analysis . Now , it is always necessary for humans to carry out necessary qualitative assessments and to determine legality or lawfulness . It has to be all adapted to changing circumstances and ensure control over the parameters , environment , and supervision during the use of such weapons . Now , where we have this link between humans and machines , still risks exist . For example , the situations where information presented is too complex to be analyzed by human beings before taking a decision , for example , identifying the deployment and use of models generated by artificial intelligence and it is also important to carry out that these limitations are even exacerbated when we are not just talking about one weapon system but when we have a network of such systems that operate in real time . So we are talking about a whole network of machines operating and this creates even more complicated situations . So this link implies that the participation of human beings will end up being simply nominal . Another challenge here is the situation related to operations where we see critical or unpredictable situations related to the application of force where humans are not in a position to have enough situational information to react in an adequate manner and to react promptly and maybe it will be even impossible for them to do anything . Then finally , the challenge of discrimination related to gender , race or other considerations and this can be related to the source of data in the system but also through the operation of processes related to algorithms . And very briefly on required measures , Mexico believes that we must distinguish between risks that require measures to simply avoid risks , risk avoidance measures which we believe are prohibitions and regulations or it is related to the discussions that we were having yesterday afternoon and this morning and also mitigation measures that may apply in a practical manner to analyze how this links up to norms of IHL and also how this will be linked to any norms that will be developed by this GG . Thank you .",Latin American and Caribbean States,Yes
ISRAEL,15:53:43,2024-03-06,0:02:11,"Thank you , Chair . We would like to make a few quick remarks on the subject of risk mitigation with regard to the development and use of laws . Approaching this topic , our Delegation understands that the concerns and measures discussed in the context in this context were intended to go beyond legal obligations encompassing good practices and policy measures , technical standards and other suggestions deliberated within this forum . While some of the concerns and measures discussed here are certainly relevant to compliance with IHL rules , even if only as practical or secondary aspects rather than primary rules , the variety of measures and their wide spectrum of implementation may often extend beyond what is required to comply with legal obligations . We suggest taking this in mind when addressing the topic . Generally in Israel's view , risk assessments and mitigation measures in their most basic sense constitute relevant tools for addressing uncertainty associated with emerging technologies , particularly improving reliability and predictability . Therefore , measures to address these concerns should be integrated at various stages of the weapons system life cycle . These measures may include but are not limited to adequate testing , evaluation and training , safety mechanisms and comprehensive assessments including legal reviews in this context . We would also like to note the distinction between foreseeability by design and technical malfunctions as these are two separate issues . A system with a very high degree of foreseeability in its functioning may still be subject to technical malfunctions as is the case with every weapons system . Finally , we welcome a fact - based informed discussion to identify and address realistic risks that are associated with laws and the appropriate mitigation measures to address those risks . Thank you , Chair .",Western European and other States,Yes
