Speaker,Time,Date,Duration,Statement,Region,High Contracting Party
FRANCE,15:56:32,2024-03-06,0:02:38,"Thank you , Chair . Chair , I would like to make a few comments of a general nature on risk mitigation and confidence building measures . Our discussions in this body focus more on the challenges posed by emerging technologies in lethal autonomous weapons systems . Of course , it is vital that we find a collective response to these challenges . However , we should not lose sight of the potential benefits of lethal systems which have some part of autonomy . There are many such benefits including to implement and respect the principles of IHL . This is a very important aspect as well as our work should not lead to stigmatization of technology unduly , technology which might offer many advantages to support decision making , for example , to protect from dangerous tasks and also to improve targeting precision . And benefits can be brought in to operations substantively so long as there are risk mitigation measures which are provided for from design to the use of such weapons systems . France calls upon high contracting parties to establish adapted risk mitigation measures including technical guarantees . States should thus commit themselves to implementing strict procedures for qualification , for verification , for evaluation and for validation throughout the whole life cycle of the system to ensure reliability . Also , technical guarantees and organizational guarantees should be established to prevent abusive use , malfunctioning , diversion and abandoning the human prerogative . To identify respective responsibilities clearly of all persons involved , states should clearly identify the responsibility chain of all those involved in decision making from design , development , qualification and use of a lethal autonomous or partial autonomous weapon system . Thank you .",Western European and other States,Yes
AUSTRIA,15:59:29,2024-03-06,0:04:12,"We would just have a short remark on the overall risk . I think it is a very good question to pose to identify the risks that are there because in the past we have talked a lot about risk mitigation measures without clearly identifying the risks . We very much welcome also a debate about this topic . At the same time when we look at the list , we see that some of them are classic risks but some of them as they are listed here also are more something that comes from the lack or not implementing one of the measures that are listed in other parts of this document of our discussion . So not doing what we see as the proper way forward in addressing the risk surrounding autonomous weapon systems is not a risk per se but this is just something of a side note . What we see I think what might be useful if we have this debate is to do a little bit of a grouping . What we see are like Mexico before us , a set of broader security risks that are also more broadly linked to our work here . There is an overall humanitarian concern as the risk of humans losing control of armed conflict while it is humans who will continue to bear the consequences of armed conflict . This has been mentioned in the past already through a number of Delegations also that there is a risk towards peace and security and a possible arms race . There is the risk of proliferation as to use of autonomous weapon systems by non-state actors seems a very high risk once the Pandora's box is open . There is also as Mexico has mentioned a risk from integrating AI in broader weapon systems but I think we have addressed this in our discussion when we have discussed AI as functions of other weapon systems . Closest to our work are probably those risks that relate to IHL implementation and those are , of course , unintended engagement , unpredictability , incidental loss of life , injuries to civilians and damage to civilian objects resulting from the use of weapon systems as such , loss of control of the system . And in this regard we also want to stress that the risks of unpredictability of a weapon systems caused by self learning and the black box problem would not only violate IHL but could impact the military utilities since no military has use for weapon systems it cannot control . There are specific security risks related to the weapon systems , cyber threats , spoofing , using other AI specific vulnerabilities and then there is this more broader AI risk list that has also already been mentioned that relates to , again , the black box problem , automation bias , discrimination for building bias and risks related to datasets , risks regarding the integrity , quality and veracity of data that is used . This also relates a little bit to the interaction between the military or the state side and the private sector . And then there is also a risk that stems from a lack of adequate training of personnel on all relevant levels and on a more broader scale also the skills degradation . These are just some general risks that we wanted to list under this topic . Many of those risks can be mitigated or even eliminated by human control and others , this is also clear , would mostly be mitigated through legal reviews , through measures on the national level as well . There is many risks but also many different ways on addressing them . In our view , the human control is already a very big aspect of this and does a lot of good work . Thank you .",Western European and other States,Yes
RUSSIAN FEDERATION,16:04:00,2024-03-06,0:09:09,"Thank you very much , Distinguished Chair . We also would like to share our comments and our thoughts on the issue of risks related to lethal autonomous weapon systems . First of all , some general comments on the theme of risks in general and how this issue is related to the mandate of our group . We believe that the discussion on risks related to autonomous weapon systems this discussion is not really directly related to the mandate of this group . It is just a first step towards the consideration of measures on the regulation or removal of risks connected to such weapon systems because our main objective as we understand it is to discuss potential measures that may be adopted to be applied to such systems . Moreover , the question of risks is something that we believe should be balanced when we take our approach to this issue . When we talk about risks , we should not forget that the use of lethal autonomous weapon systems in comparison to other weapons systems that are being employed during military conflicts , this use may represent some advantages and provide some opportunities in the context of compliance and implementation of the principles and norms of IHL . Specifically , we are convinced that lethal autonomous weapon systems can demonstrate greater levels of effectiveness than a human operator in solving the objectives that were set and reduce any errors . In particular , such systems are capable to seriously reduce the negative consequences of the use of weapons in the context of IHL related to operator errors , the psychological and physical condition of the human being , moral , religious and ethical considerations . Their employment in line with IHL may increase the precision of attacks against military objects and may contribute to reduce the probability of unintentional strikes against civilians and against civilian objects . We believe that all of these advantages together with the risks that we are discussing right now should be taken into consideration by our group as we discuss any specific measures that can be applied to lethal autonomous weapon systems . Now , on the question of risks , we would like to especially highlight such risks that directly relate to these weapon systems and do indeed represent a reason why we need to give additional consideration to them in the context of compliance with IHL . And the risks are as follows : The use of weapon systems with artificial intelligence or lethal autonomous weapon systems that these systems end up in the hands of non-state actors , including terrorist formations and some of the bullets on the screen are connected with this issue and they could be kept here . We welcome the fact that they are represented in this list . Another risk that requires our attention is the loss of control over a system as a result of a technical malfunction or break - in or the reprogramming of a system by malicious actors . And we see that some of the bullet points on the screen is related to this risk . And we are ready to work with these ideas because they do require that delegations give attention to this as we discuss and agree to specific measures related to mitigation of risks connected to laws . And as a third risk that we would like to highlight is something related to the taking by the system or by the operator of erroneous decisions . And when we refer to these three types of risks , we believe that through this type of language , we actually are covering all the bullet points that you see on the screen because the questions of human judgment , the questions related to the behavior of systems , as well as the notions of predictability , reliability , we believe that they all boil down to the risks that I referred to . And they relate to a situation where a system or the operator can take an erroneous decision . We believe that this is exactly what we should focus on as we discuss the different measures to regulate or remove such risks . And here we would like to stress and also join what other Delegations said before us , saying that the discussion of all the questions related to the mitigation of risks , all of this should be done with a direct connection or link to existing international humanitarian law and ensuring compliance under IHL , keeping in mind the certain technical features of lethal autonomous weapon systems . Thank you .",Eastern European States,Yes
PAKISTAN,16:13:33,2024-03-06,0:07:58,"Thank you , Chair . Chair , on the question of risk mitigation and confidence building , first we would briefly describe what our understanding of risk mitigation and confidence building measures is . We in our past work , we have always understood that these measures do not exist in isolation and specifically in this body in which we are working in CCW , whenever we have had discussions , we have always held this view that the purpose , the main purpose of this body is codification of existing law , progressive development of law , mainly IHL , the international law of armed conflict and in that context , the best way to mitigate the risks are to address directly the challenges in a way we have addressed them in the past . However , having said that , there is certainly value in the risk mitigation measures as long as they are linked with something , as long as they are complementary to something . They are not existing in silo or in a vacuum . If we look at the examples of past , as you have also pointed out , Chair , that we are not starting from scratch . We have to build upon our previous work . We see in the existing protocols also in protocol 5 , for instance , there is a technical annex which talks about best practices , which talks about different practices that need to be instituted at the state level . For instance , for greater compliance of Article 4 , Article 5 and Article 9 of the protocol 5 . So in that way it is very clear that those kind of best practices are rooted in that protocol . Second point would be that what my distinguished colleague from the Russian Federation has stated , I would very much agree with the characterization that while the work that we are doing under this topic is not directly linked with the mandate which the GGE has been tasked to do , at the same time it is very much the start at the outset , the commencement of our work because if we are going to be addressing the challenges , we need to be cognizant of what those challenges and risks are . So it is very pertinent that we are addressing this issue right at the outset during the first week . And we are also very pleased to see the first question that you have outlined where you are inviting the Delegates to share what are those possible risks in this area . Then next I would just like to endorse some of the points that have been made by Mexico , for instance , that when we are talking about the risks , I think it would be better that we go in a holistic , in a comprehensive manner and in a structured manner as well . We understand that the text , for instance , that is on the screen is not something that the Chair has himself proposed but is coming directly from the submissions that have been put forward by the state parties . I think going forward it would be valuable if we are able to structure our risks in a manner in which we have done in the past as well and in a manner in which they have been proposed and raised in this body . Here I would very much like to agree with our Distinguished Colleague from the US who also pointed out under other topic that if we are able to follow this kind of structured methodology under various topics , we would be able to perhaps narrow down our points of convergences . So when we talk about different categories of risks , we understand that some of them or most of them on the screen that have been presented are mostly a result of different omissions or different actions that the states , parties or users or operators , if they are unable to take those actions in terms of development , deployment or use of these weapon systems , what those risks could result in . At the same time , we would like to highlight that we would like to categorize these risks under what was described as humanitarian , ethical and security considerations . I think that would give us greater clarity . From what we see , many of the risks that are already on the screen could be parked in one of those categories right now . One category I think that we need to take stock of is the risks under the category of security considerations . This is very much pertinent to the work that we have been doing in the past as well . When the work started in the informal body of experts in 2014 and the report that we all adopted by consensus in 2016 , the group identified what those possible risks from the security angle would be which merited further study and consideration . I would just read them out here . The risk of an arms race , the effects on the threshold for armed conflicts , the effects on regional and global security and stability and proliferation risks including to and by non-state actors and risks posed by cyber operations in relation to laws . So this was what the group agreed by consensus in 2016 . Then going forward , we also saw that very comprehensive discussions took place in 2019 in that GGE as well in which there was broader understanding and convergence of these risks under security considerations and some of them we were able to allude to , refer to in our guiding principles as well which you have detailed in your opening remarks . In 2021 in the Chair's summary under an exclusive agenda item as well and then in 2023 when we had the discussions on the negotiation of the report , we had a separate section on risk mitigation . So these conversations have been taking place for a while . It is important that at this stage we are able to take stock of all of these conversations and proposals in a more holistic manner and park all of these risks which have been brought up by different high contracting parties under these three categories , humanitarian , ethical and security considerations . I would just like to briefly subscribe also to the views that have been expressed by Mexico , Austria as well relating to humanitarian category and ethical considerations as well , the risks that they have very eloquently elaborated upon . So we have going and based on this categorization we have comments to offer as well on what measures are needed for those risks but I believe that is a question that I think you would perhaps would like to address it under the second question when we go to that . Thank you . Thank you very much for that .",Asia-Pacific States,Yes
SWITZERLAND,16:21:39,2024-03-06,0:05:54,"Thank you , Mr. Chair . We really appreciate this discussion on risks and we broadly agree with the topics that you have listed . We are moving very fast and what we are going to contribute at this stage is just the first reaction . We might come back with more specific points later . I also want to say that it is hard to follow the Distinguished Colleague of Pakistan who spoke just before me because a number of the points that I am going to say he just made them very eloquently . Our overall understanding on the broader topic of risk mitigation confidence building measures is that in addition to measures that are strictly necessary to ensure compliance we also need additional measures , complementary . Our view is also that such measures must not be in the vacuum . They must not stand isolated . They must not stand instead of a clear regulation . One way to see this is that we perhaps would anticipate a further future legal instruments with prohibitions and regulations and then a complementary set of practices , measures , for instance , outlined in an annex to a protocol or to an instrument of whatever nature it is . We think we can now start thinking a little bit more clearly about how this could articulate the provisions , the legal provisions and then further measures . At this stage I would first like to pick up the discussion about the risks overall and like other speakers before me , try to talk a little bit about what we have here on the screen . Our first general point and here as Pakistan has just said we think that this list could be streamlined , structured , categorized . We have talked about risks in the past and we were able to line them up in a coherent fashion . Then a second very important point relates to what Austria and Mexico have said before us . Risks must be really better understood . There are many possible risks that we are just about to understand here . We might not yet have the full picture , even risks , there might even be risks that today are yet unknown . This is really a difficult discipline here for us because the technologies are emerging and so it will be very important that we start thinking about how we will be able to continuously improving our understanding of risks in a comprehensive manner . And that comprehensive manner , that brings me to another general point . It is important for us that we in this forum where we pursue an IHL focus stay aware of the fact that while IHL compliance is extremely important and noncompliance is , of course , an enormous risk as these weapons develop , there is also other risks and concerns . Risks that go beyond of what we are looking at usually in this forum . For instance , ethical aspects , they have been mentioned by others , but then also potential impact on international security , stability , for example , the potential possibility of an arms race , escalation risks , decrease in crisis stability , and then we have more technical risks , guiding principle F in 2019 already referred to physical security , hacking , data spoofing , et cetera . Then we have also talked a lot about the unintended biases related to gender , race , age , ability , et cetera . And we have also referred in the past to the risk of acquisition by terrorist groups , nonstate actors and the risk of proliferation . And to end this first intervention , I would just briefly remind Delegates of the preambular paragraph 4 of the UNGA resolution adopted last year which kind of made a good summary of the concerns that are out there , perhaps also out there beyond the CCW and which are on the top of the minds of 177 countries , I believe , and that is concerns about global security , regional and international stability , including the risks of an emerging arms race , lowering the threshold for conflict and proliferation , including to nonstate actors . So it is not to say that the risks that are on the screen here are not the right ones to list , but it is just to make sure we stay on top of things and have a broader risk perspective and that we aim to always try to better understand risks that are only about to emerge . Thank you .",Western European and other States,Yes
CUBA,16:27:49,2024-03-06,0:04:06,"Thank you , Chair . I would like to share with you some of our thoughts on the question of risk mitigation in this process . My Delegation believes that the focus that should be prevail in connection with laws is not simply to prevent or mitigate risks , but to avoid risks in the context of regulations and prohibitions . We believe in order to do that , we need to ensure that human control is maintained . We also have to consider physical and nonphysical barriers that would prevent the acquisition of these weapon systems in the hands of nonstate actors putting obstacles on the proliferation of such weapon systems . We believe that anything that uses software can be hacked or used by state and nonstate actors and laws also can fall victim to such actors . And due to the nature of such systems , they will be very vulnerable to cyber attacks . We have to stress that we cannot say that there is no possibility that when these weapon systems are used in the battlefield , they are software cannot be manipulated and also it may lead to a situation that an operation cannot be aborted if there are malfunctions to the system . And these are technical vulnerabilities of any machine , but in these , in this particular situation , it can be the great loss of human life , environmental losses and other harm . This strengthens our belief just like other Delegations on the need to ban completely laws , including those that do not include the or those that include the possibility for their deactivation . This is connected to serious concerns related to cybersecurity and as such systems are deployed and used , especially when these systems are not communicating with the operators , it leaves a lot of time for the systems to be manipulated by others . It can take time to identify security vulnerabilities in an autonomous machine and we have to ask a question , will it be possible to correct this vulnerability in a remote fashion or recover the device or ensure that there is human control at all of these stages ? Also , we believe that confidence building measures , even this is a useful tool that has been employed very successfully in other areas , will not be sufficient in this particular situation . When we talk about laws , in the context of this new mandate and the elaboration of a new instrument of other measures , we have to focus first and foremost on prohibitions and regulations to only after that complement this with other CBMs to promote transparency and ensure physical security of such system avoiding risks of diversion but by not state actors and others . Thank you .",Latin American and Caribbean States,Yes
PHILIPPINES,16:32:14,2024-03-06,0:01:43,"Thank you , Mr. Chair . The Philippine Delegation wishes to add some of the risks which were surfaced during the meeting on Indo - Pacific Perspectives on autonomous weapon systems by states , many of which are not represented here . In the interest of time , the Philippines would only articulate and highlight two . First is the impact of autonomous weapons on armed escalation of existing conflict . The benefits of autonomous systems in reducing human casualties may attempt military commanders to use them early in conflicts . This can lower the threshold for the use of force and escalate existing conflicts . Second and personally more important for me is the possible impact of the development of these weapons on the environment and ecological integrity , particularly in our case are their impact on the maritime space and environment . It has been frequently commented in various fora that autonomous submarine warfare is relatively more acceptable due to the low risk of human collateral damage underwater . But we wish to point out that damage to the marine ecology that these weapons may cause is directly related to the livelihood of many island and archipelagic states in the Indian and Pacific oceans . To many in our part of the world , marine ecology is life . We hope that these risks and concerns can be taken into consideration as well in our discussions . We would also like to support the comments made by Pakistan and Switzerland on the utility of identifying categories of risks such as humanitarian ethical and security considerations to better structure our discussions . Thank you , Mr. Chair .",Asia-Pacific States,Yes
URUGUAY,16:34:17,2024-03-06,0:01:38,"Thank you very much , Distinguished Chair . I would like to make a couple of brief comments during this interactive dialogue just like was done by Austria following certain statements made by colleagues . I would like to say on risk mitigation , I agree with the views of Mexico and Pakistan related to the risks to international security and my Delegation agrees with that . And also to recall that we are talking about an environment where IHL applies but not only international humanitarian law but also international law and different branches of law . And also to recall that the majority of states are not participating in mitigation risks exercises and they suffer from the effects of the use of different weapons and also we have to say there are some risks that have to be avoided or eliminated and not simply mitigated . I was interested in the comments made by Switzerland about the possibility to include an annex to the possible protocol with measures related to risk mitigation . So that will be it for the time being . Thank you .",Latin American and Caribbean States,Yes
