Speaker,Time,Date,Duration,Statement,Region,High Contracting Party
UNITED STATES,17:11:46,2024-03-06,0:07:32,"Thank you , Mr. Chair . We are going to try to offer reactions on both the risk question and the risk mitigation measures question in this intervention and then we will return to the confidence building measures at a later time . Now on the risks themselves , we agree with many of the overall points that others including the UK and Switzerland have made today . The first is that many of these risks are subsidiary risks of broader and overarching risks on the list and the second is that we already have a significant body of consensus language on risks , including in the guiding principles and in prior GGE reports . For our Delegation , the most important risk to focus on and seek to mitigate is the risk of unintended engagements which is closely related to the final bullet on risk of harm to civilians . We consider many of the risks identified in the bullets as related to these two overarching risks and do not think the risk of unintended engagements should be merged with the loss of control over a system or the loss of human control as these are not the same concepts . To respond to the point that the Delegate from ICRAC just raised , the US Delegation considers the risk of unintended engagements to mean that the weapon system is engaging targets that the system operator did not intend to engage . So in that sense it is broader than just civilian harm . The loss of control over a system does not necessarily lead to unintended engagements and unintended engagements may be caused by a variety of factors including but not only through the loss of control over a system . Now , just briefly with respect to the point about using previously agreed language , we did want to reiterate the point made by others that we have consensus language on many of these risks . So just for example , with regard to the risk noted in the list as loss of human control in the first bullet , we would point to the 2019 report where we have several paragraphs that reflect this general concern such as guiding principle D which refers to a responsible chain of human command and control . Another option consistent with the paragraph that we agreed in our 2023 report in paragraph 21C could simply be to omit the word human and refer to a loss of control . With regard to the second bullet that begins with unpredictable system behavior , we think this bullet needs a little bit of clarification . We should focus on unpredictability that may be related to unintended engagements or risk to civilians . So again , this is a subsidiary to those two broader risks . Finally , with regard to the third bullet on reliability , this is not a risk as we see it . So we would remove that from the list . And then lastly on the issue of bias , we would recommend describing the risk as unintended bias in AI capabilities . We suggest to add the word unintended to be more specific about the type of bias that are problematic . Indeed , distinction is an important IHL requirement . We also think it is appropriate to refer to AI capabilities rather than just generally to AI . Now moving on to risk mitigation measures , this is a topic where the GGE has had many fruitful discussions in the past . In looking at the various proposals that Delegations have submitted since 2022 , there is really a great deal of overlap and similarity in identifying concrete actions that states should take to ensure and promote compliance with IHL . And we also again like the prior topic already have a body of consensus language that we can expand on . Many of the concrete measures on this list from rigorous testing and verification to weapons reviews to understandable human machine interfaces are included in the prior two prior joint proposals cosponsored by the United States and also in consensus GGE language including the 2019 and 2023 GGE reports . While not specifically framed as a risk mitigation measure , paragraph 22 of last year's GGE report states that when necessary , states should in derailia limit the types of targets that the system can engage and limit the duration , geographical scope and scale of the operation of the weapons system . Now , in addition to these general points , we did just want to make a few specific comments on a handful of the bullets . We will start by addressing bullets 9 and 10 together . The ninth bullet addresses the use of a weapon within a responsible chain of human command and control . Our draft article's proposal includes a number of measures that states should implement to ensure comprehensive accountability for the use of autonomous weapons systems including that states should only deploy laws within the state's general framework for implementation of IHL such as operation of such system within a responsible chain of human command and control . Thus , as we see it , the tenth bullet which says permit attribution of responsibility to individuals and states is not a separate risk mitigation measure but rather a goal or effect of the measure addressed previously . With respect to the 11th bullet which begins with the phrase alternative tools to ensure human control , again , we do not see these as measures but rather as a potential goal or effect of other measures . As our Delegation has said many times , human control and human supervision and intervention are not legal requirements . The very purpose of autonomy is to allow machines to carry out tasks that humans have previously performed . That said , measures such as controls and limits on targets or the incorporation of self - destruct or self - neutralization mechanisms can be risk mitigation measures to reduce the risk of unintended engagements . These measures can be implemented through mechanisms or software programming in the weapon system but they could also be included as fundamental attributes in the design of the weapon system such as the maximum amount of fuel available to the system which would affect its operating duration or its maximum geographic scope or by the number of munitions that a weapon system carries . Lastly , with respect to the 12th bullet which begins with ensure predictability , traceability and accountability and also mentions things like reliability and explainability , again , these are not measures but rather a goal or effect of other measures that can be adopted to effectively implement IHL . Our Delegation believes that we must give precise and implementable guidance to states on what measures they can take to mitigate the risk of unintended engagement in the use of laws . Ensuring predictability is not a measure but many of the other measures on the list from rigorous test and evaluation to validation and verification measures , these are measures that we think would help address the underlying concerns that Delegations who suggested this language have in mind . Thank you , Chair .",Western European and other States,Yes
BRAZIL,17:19:53,2024-03-06,0:03:34,"Thank you , Mr. Chair . I would like to use this occasion to introduce in a more thorough manner the proposal that we have introduced as a working paper to this session . It was circulated as WP1 . This is a proposal for the GG to consider the possible utility to its work of IEEE standard STD7007 2021 . It is our perception that this standard can be useful in many areas of our work including in terms of risk mitigation , confidence building , transparency and accountability . The IEEE , the institute of electrical and electronics engineers is an international professional association . It was formed in 1963 with over 400,000 members in over 190 countries . In 2016 the IEEE established its global initiative on ethics of autonomous and intelligent systems . This initiative led to the development of the first global ontological standard for ethically driven robotics and automation systems , the IEEE standard that I referred to earlier . The standard was developed by a working group chaired by Professor Edson Prestes from the Institute of the Federal University of Brazil . This standard is an ontological standard aimed at enabling the development of ethically driven robotics and automation systems and it offers ethical methodologies for the design , development and deployment of artificial intelligence . It is a core ontology . So it represents a midlevel set of formalizations and commitments that are platform independent . It is intended to fit between an upper top level of or foundational ontology and lower domain or application specific ontologies . It has a data modeling representation at the level of abstraction that is above specific database designs . The data that is generated according to this methodology can be exported , translated , queried and unified across independently developed systems and services . It contains a set of ontologies that represent norms and ethical principles , data privacy and protection , transparency and accountability and ethical violation management . In our view , the STD7007/2021 might prove useful both as a risk mitigation measure and as a step towards confidence building and accountability . It offers a common platform for progress on the discussion of core concepts such as control mechanisms , limits on targets , duration and geographical scope of operations . By addressing these topics through the standards framework , states can establish the common approach for evaluating the development and use of autonomous weapons systems . Another key advantage is the standards ability to preserve confidentiality and to protect industrial Intellectual Property . It might be useful as a reference at all levels . At the national level , it can serve as a standard for the development and assessment of autonomous weapons systems , technologies at all stages of its life cycle . At the regional and international level , it might serve as a common platform for the exchange of information , confidence building and transparency and accountability measures . Thank you very much , Mr. Chair . I would like to thank you for highlighting the main aspects of your working paper .",Latin American and Caribbean States,Yes
INTERNATIONAL COMMITTEE FOR ROBOT ARMS CONTROL,17:24:14,2024-03-06,0:02:02,"Thank you . Once again , thank you , Chair . My apologies for taking the floor again . I want to start by expressing appreciation to the US Delegation for their response . The first thing which we want to emphasize again is the question that consensus language in the UNGG reports is important but must not be inconsistent with existing IHL language or other obligations . In relation first to the aspect of unintended engagement which the Delegation has explained that this refers to the system engaging targets other than those authorized by the operator , does this mean then that the system has autonomy in critical functions ? Does this not fall under autonomous open systems that must be prohibited rather than mitigated ? In relation to the second point on unintended bias , what again is meant by this ? Chair , in terms of rule 88 of customary international humanitarian law , the words that are used is adverse distinction . In terms of international human rights law treaties to which Delegates or States are party , the term that is used is the right to non-discrimination . In our view , the risk here can be properly identified as risk to the right to non-discrimination . The word unintended is not helpful because gender and racial discrimination or any other form of discrimination is not only harmful because it is intended . It is harmful because it is discrimination . And as ICRC , we insist on using language that already exists in binding treaties . Thank you . Thank you for your contribution . We have been moving around among the different slides for this topic 3 . So if you have any need for another slide being shown , we stand ready to do so . I also understand that the text has only been shared during the day . So you might need some further reflection for that . I am ready to offer that and we could come back to topic number 3 tomorrow morning . I am in your hands for that . Because if there is no more appetite to continue discussion now , I think then we should not try to force that .",Non-applicable,No
REPUBLIC OF KOREA,17:27:27,2024-03-06,0:01:49,"Thank you , Chair . I did not want to prolong the discussions , but I wanted to make the following comments , knowing that this might be the last chance to speak today . A number of risks and risk reduction measures listed seem to be directly related to elements that would form an integral part of regulations that would be required to ensure the lawfulness of development and use of laws . As such , and as Austria and the United States propose , it would be useful to do some boxing work work and also differentiate between the essentials and subsidiary considerations and countermeasures . To this end , after we complete the initial round of discussion to add to and delete from the current list on Topic 3 , we could work on coming to a common or shared understanding , if not agreement , on the main categories of prohibitions and regulations first and then deal with how we may address other subsidiary yet important considerations such as ensuring safeguards against the data theft , alteration and proliferation at a later stage . And on a final note and before I close , we would support the addition of the word unbiased in front of bias , sorry , in front of unintended , unintended in front of the word bias because some intended bias is necessary to ensure the lawfulness of laws in order to obtain the intended effect . In other words , to ensure that the laws that we employ target the targets that we have preselected , some bias would be necessary in some cases . Thank you . Thank you for reminding us of that . Okay . I think it was a long day . And we had a long of very , very good discussions . You gave us some homework .",Asia-Pacific States,Yes
UNITED STATES,17:30:03,2024-03-06,0:06:19,We will certainly start doing homework on streamlining categorizing that might help also future discussions .,Western European and other States,Yes
AUSTRIA,17:36:48,2024-03-06,0:02:26,"I think everyone has deserved to go home at this moment but it is a very interesting topic and I think it is a concept that deserves a little bit more attention . The big question here is the question is there unintended bias or not ? It is a conceptual question , probably one we should agree . There are different ways of seeing it . We see it and this comes probably also from the kind of work that has been done in other international organizations on AI as something that is per se unintended . The problem if you talk about bias is that bias is a reflection of something that is already intrinsic in societies . If you talk about bias in our context , any kind of discrimination that is there to comply with IHL is not bias . It is something that has been deliberately programmed into the system to comply with IHL . In that case it is not bias because bias would more or less be an accident . We had this discussion today . There are different types of biases . There is the kind of bias that stems from faulty datasets or not programming but kind of the way the datasets are selected , implemented , maintained . Also the cognitive biases that exist in human existence or the way that the human brain works . I have here a list that includes stereotyping , bandwagon effect , priming , selective perception or confirmation bias . Those are just cognitive biases that you can see in everyday's world and that are then introduced into an algorithmic system and then you have something that has come up often today , real life prejudices which are racial bias , gender bias and so on . It is a very wide area . It is all in most cases faulty . It is not intentional and a bias that is there for having kind of a positive discrimination on the battlefield in our interpretation is not a bias but it is something that has been placed there to comply with IHL . Thank you . Thank you for that explanation . Yes , I think I can now try to look at our work for tomorrow . I see three topics , issues to be addressed . A possible continuation of this discussion tomorrow morning after having given it again some thought overnight . Then we are doing some work to revisit the discussions we had earlier , for instance , on definition , characteristics and applicability of IHL making especially with regard to applicability of IHL making use of already existing texts , agreed text from earlier meetings and I promised you to have a discussion on way forward again today we have had already some reflections from certain Delegations but I think it would be good to have a kind of Delegated moment in the day tomorrow for that . We will look a bit at how things go in the course of the morning and then we have , of course , still the Friday morning and for the Friday afternoon we have another agenda item scheduled , other matters , that means other matters related to the mandate and the agenda . And that is it for my side . I am looking if there are any announcements . No , there are not . Then I would like to adjourn the meeting and see you tomorrow morning at 10 o'clock . Thank you very much . Enjoy your evening .",Western European and other States,Yes
