Speaker,Time,Date,Duration,Statement,Region,High Contracting Party
INDIA,16:36:10,2024-03-06,0:00:00,"Thank you , Mr. President and thank you once again for the very informative visuals that you have up there on the screen . My Delegation would like to is under the impression that we are discussing possible elements of an instrument . That is the mandate of this group . We have been discussing risks for the last ten years as many of our colleagues and many Delegations here have reminded us and it is my understanding that most of what the risks of laws are clearly understood . My Delegation believes that we are focused on an instrument and would like to be guided by the place of enumerating risks if there is a place for that in a possible instrument . This section in an instrument , if such an instrument reaches a stage of further consideration , in our understanding addresses risks that cannot be addressed in the section on commitments and obligations . Several such risks that are listed here will be addressed by the obligations such as prohibitions and restrictions that are under discussion . There are also well established understandings based on the range of measures that are available when an instrument such as this is being constructed . The second of your guiding questions addresses that . Some of these are TCBMs , notifications , exchange of data , codes of conduct , et cetera . There has to be a relation between the risks and the mitigation measures that take into account , for example , applicable Treaties and international law . That is all , Mr. President . I just want to focus on the construction of an instrument in which the risks and mitigation measures are linked to each other and to the larger structure of an instrument instead of going on to a general discussion on what all possible risks associated with the use of laws are . Thank you .",Asia-Pacific States,Yes
INTERNATIONAL COMMITTEE FOR ROBOT ARMS CONTROL,16:39:55,2024-03-06,0:02:43,"Thank you very much , Chair . My general comments here want to focus on the question of using agreed language when identifying risks . Indeed Delegations have emphasized the importance of using agreed language . In our understanding agreed language does not only mean language included in previous reports of this group but also includes language found in IHL and other binding sources of international law . There are three phrases or terminologies currently Chair on the screen in reply to your prompts that we want to focus on . The first phrase is the phrase unintended engagements which does not appear in the text of the CCW or the Geneva Conventions in the additional protocol . Does the risk of unintended engagements mean the risk of unintended killing of civilians or protected persons ? If that is the case it is better to keep to IHL language on indiscriminate attacks or civilian harm . Second , phrases like algorithmic bias or simply bias do not sufficiently capture the risk being referred to . In its place it may be better , for example , to talk about the risk of discrimination or the risk of gender or racial discrimination , phrases which exist in binding legal norms . Third , the phrase risk mitigation , the phrase risk mitigation does also equally does not appear in the text of the CCW or the Geneva Conventions and the additional protocols . It is critical that we explain what we mean by this and how this aligns with established international legal obligations such as those that are found under international humanitarian law . Chair , some risks that are posed by laws already necessitate compliance with state obligations that exceed mere risk mitigation . Let me just give two examples , Chair . Let's talk about the risk of arbitrary deprivation of the right to life due to failure to comply with rules of distinction , for example . The obligation there is an obligation of prohibition on arbitrary deprivation of life . It is not an obligation to mitigate that particular risk . So when we say we are trying to mitigate risk , we need to be clear which particular risk we are referring to . If you look , for example , at the risk of racial and gender discrimination , the existing international obligations on state is to eliminate all forms of racial and gender discrimination . It is not to mitigate that particular risk . So it is very important in this particular regard for us to have some clarity . Lastly , it is evident , Chair , that certain risks posed by laws entail international obligations that surpass mere risk mitigation . While introducing new terms is permissible , caution must be exercised to avoid terminologies that undermine existing obligations . In cases where clear state obligations pertain to specific risks , any proposed risk mitigation should be regarded only as supplementary to existing obligations . With that , Chair , I thank you .",Non-applicable,No
GUATEMALA,16:44:07,2024-03-06,0:02:08,"Thank you very much , President . Since it is the first time I am taking the floor today , I would like to thank you for the work that we managed to accomplish here in this group . Indeed , this is a very enriching discussion . We have been seeing some convergence on some issues and we see that we have to discuss others . Now , some general comments here . Guatemala believes that we have to look at the issue of risk mitigation and confidence building measures in the area of laws . We have to , in this context , qualify the risks related to use of artificial intelligence and weapons systems to see what consequences this may lead to in terms of international peace and security . I would like to list some of the risks that we have identified supporting what was said by other Delegations before us . First , the possibilities that these weapons systems will fall into the hands of terrorists and non-state actors and situations where human judgment will not be applied and also the vulnerability of the infrastructure of the systems to cyber attacks and also who will be assigning the responsibility for the use of such systems . Finally , we would like to support the comments made by other Delegations on the need to eliminate risks that are incompatible with IHL and not simply limit ourselves to mitigation . Obviously , there are quite a few other risks that we must refer to , but this will be our views right now so that we can continue our conversations and I do hope that I will be able to take the floor once again to make some specific comments on the bullet points we see on the screen . Yes , of course .",Latin American and Caribbean States,Yes
EUROPEAN UNION,16:46:31,2024-03-06,0:00:56,"Thank you , Chair . I would like to make a general comment and one of more specific nature on risk mitigation . The European Union is of the view that tailored risk mitigation measures including those across the life cycle should be adopted and implemented and with regard to the question of risk with regard to the development and use of laws and specifically on bullet 4 , the EU recognizes the critical role that data plays for AI - based technologies . Social biases that have a potential impact on emerging technologies , for example , for gender bias in algorithms should also be given due consideration . Thank you .",Non-applicable,No
UNITED KINGDOM,16:47:42,2024-03-06,0:05:16,"Thank you , Mr. Chair . Over the years , this group has heard various categories of risks in relation to autonomous weapon systems . Like a number of previous Delegates have suggested , these risks really need to be streamlined and categorized . We would suggest that there are geopolitical and security risks including proliferation risks , ethical risks , application risks , that is those risks which apply in the context to the development and use of autonomous weapon systems and system security risks . The discussion leading to the conclusion of elements of an instrument will need to be based upon a good understanding of which category of risks those elements are addressing and how that risk engages . We note so far in this session that this group has already had some good discussion under your guidance which has both implicitly and explicitly raised risks such as absence of context appropriate human involvement , accountability , chains of command , limitations and predictability to name but a few . Therefore , the key matter here is how we mitigate those risks and introduce or articulate confidence building measures . We believe that those risk mitigations and confidence building measures would be key to the second tier of the two - tier approach with the nature or category of the risk absolutely material to the nature of the measure to address it . Looking at the risks on the list that you have provided , they therefore might be categorized as failure and reliability risks in use and design which would incorporate bullets 1 , 2 , 3 and 4 . Governance risks which would be bullet 6 . Geo and national security risks which would be bullet 7 and system security risks which would be bullet 8 . Bullets 5 and 9 are written in a degree of short hand and are probably captured elsewhere but would largely appear to sit in the failure bracket . But as I have suggested , the categories identifiable do not reflect a comprehensive selection of potential risk categories . That said , one overarching factor is that fast developing complex technologies need to be regulated in a manner that is tailored to the relevant technology concept and manner of use . This is a dynamic process which requires the development and sharing of expertise and practice that best enables the fundamental principles of the law to be enacted , making a tangible impact in the development and use of future weapon systems , helping to mitigate any risks associated with the integration of autonomous functions within weapon systems whilst maximizing the benefits . Both the UK proposal for an elaboration of a document on manual that would constitute an authoritative and comprehensive statement of the application of IHL and agreed best practice and the paper that the UK is cosponsoring would be useful and important outcomes that would build confidence that there are rigorous principles of concern that govern the use of autonomous weapon systems and ensure accountability in accordance with IHL . The UK's proposal is for the GGE to commission a document that sets out guidelines , advice and best practices on how states should approach the development and use of emerging technology in the area of laws at each stage of its life cycle . This would include an assessment on any characteristics which would be necessary compliance with IHL and any characteristics which would be incompatible with IHL . The document might include examples that illustrate what good practice is or might look like , providing a clear framework for the operationalization of the GGE guiding principles and actionable guidance for policy , technical and military stakeholders . It would thereby encourage the adoption of national regulations designed to strengthen respect for international humanitarian law and the UK paper outlines suggestions for areas that might be included in the document . We have previously stated that these areas would not be viewed as exhaustive or definitive but simply as an example of the sorts of things that such a document could cover . The cosponsored proposal sets out a series of regulatory measures on the basis of international humanitarian law . It advocates a series of draft articles which would constitute an impactful measure by setting forth common international understandings of prohibitions and other regulatory measures for the effective implementation of IHL principles and requirements in relation to laws . We believe that both these proposals provide a meaningful advancement to efforts to drive the behavior of states in relation to the adoption and use of autonomous weapon systems and would be important and useful risk mitigation and confidence building measures . Thank you .",Western European and other States,Yes
CHINA,16:57:45,2024-03-06,0:03:53,"Thank you , Chair . Our Delegation appreciates the contributions made by all parties on issues relating to laws which can lay a foundation for future discussions of the GGE . On risk mitigation and CBM , we have noticed the references on the screen on text about legal reviews , testing , evaluation , as well as other issues . Our Delegation would like to highlight the following observations . First , on testing and evaluation , bullet No. 18 , and training , bullet No. 28 , we should further strengthen testing and evaluation in light of technological development and avoid misuse and abuse of relevant technologies . We should also provide appropriate and targeted training so as to enhance the understanding of laws by commanders , operators , researchers , and other relevant personnel . Second , on legal review , bullet No. 25 , legal review is stipulated in Protocol 1 of the Geneva Conventions . All states parties should strictly implement their obligations . Most states parties , including China , have relevant review and evaluation mechanisms . As a CBM , countries are encouraged to formulate corresponding legal review mechanism in light of their national conditions . Third , on responsibility , No. 41 to 45 , the ultimate responsibility for the development , deployment , and use of weapon systems lies with humans . Countries should clearly define relevant responsibilities in accordance with their national policies and regulations and applicable international laws . At the same time , the due use nature of emerging law - related technology should be fully considered . An overly strict accountability system may have a negative impact on the development and application of emerging technologies . Fourth , on temporal / spatial restrictions , bullet No. 59 is not right now displayed on the screen . Consensus was reached during the previous session of the GGE . The final report states that , I quote , when necessary , limit the types of the targets that the system can engage . Limit the duration , geographical scope , and scale of the operation of the weapon system . Fifth , we encourage all countries to conduct voluntary exchanges and cooperation on risk mitigation measures , including through case studies , scenario analysis , experience sharing , and communication with international organizations and nongovernmental organizations in order to jointly promote the peaceful use of emerging technologies and bridge the technological gap among countries . We oppose the restriction of technological development of other countries on politicized grounds and the creation of obstacles to international cooperation exchanges in the field of new technologies . Thank you , Chair .",Asia-Pacific States,Yes
INTERNATIONAL COMMITTEE FOR ROBOT ARMS CONTROL,17:02:16,2024-03-06,0:01:47,"Thank you very much , Chair . It is just a really quick intervention on the utility of legal reviews as a mitigation measure . Chair , we acknowledge that actually legal reviews are important and are critical and can be able to serve this purpose . But I think there is an important point that we ought to remember . Legal reviews , in other words , they are conducted in accordance with existing international law , existing international humanitarian law and other relevant legal norms . Now , Chair , one of the key questions that is yet to be answered or for Delegations to find common ground is whether existing law , the law in actual effect that we use when we conduct legal reviews is adequate to govern lethal autonomous weapon systems . Now , ICRC and other notable stakeholders have noted that existing law may not be adequate to govern autonomous weapon systems . Now , in that regard , Chair , legal reviews utility in this particular point become very limited because we will be in a way using a measure or a scale that is inadequate to try and see whether , for example , a weapon is acceptable in terms of law . So that is a point which we just want to underline to say legal reviews utility can only be useful where existing law is adequate to govern the particular weapon that we are dealing with . Thank you for that remark . And , of course , one of the big questions here is indeed whether and how much additional regulation we need . So then in the end the problem could be solved . But yes , as we stand now , you might really have a point .",Non-applicable,No
ICRC,17:04:31,2024-03-06,0:03:36,"Thank you , Chair . The ICRC on this topic sees some of the things that are listed as mitigation measures here not as optional or context specific but rather as clear legal requirements and I think this was already flagged to some extent by some Delegations in the previous question including the representative from Mexico . I just wanted to highlight two very clear examples . Firstly , the reference to legal reviews , effective legal reviews are a clear obligation for states that are party to additional protocol 1 and for all states they are critical to ensuring that their armed forces comply with IHL rules in the use of any weapon systems . And the ICRC endorses the view which has already previously been recognized by this group's guiding principle in subprinciple E and previously by states in other sessions of this group . We endorse that weapons reviews of autonomous weapons are a crucial step in the process of ensuring compliance with international law just as they are with any new weapon system that is being studied or developed , acquired or adopted . The other clear example that I wanted to point to in this screen is the text in the sixth bullet point that refers to assessment of expected civilian harm and concrete and direct military advantage . Chair , this directly reflects the prohibition that is contained in Article 51.5B of additional protocol 1 and accepted as part of customary IHL and it prohibits attacks that may be expected to cause incidental loss of civilian life , injury to civilians , damage to civilian objects or a combination that would be excessive in relation to the concrete and direct military advantage anticipated . I think there are others in the list including regarding the training of personnel , allowing attribution of individual and state responsibility and instituting mechanisms for reporting , investigating and ensuring accountability for IHL violations . These are already clear existing IHL obligations . So we would have some serious concerns with any language that ultimately suggested that these obligations were somehow discretionary rather than mandatory . Finally , many of the other points on the screen relate to aspects that we have previously argued including throughout the course of this week need to be incorporated either as aspects of a prohibition on certain autonomous weapon systems and here we are particularly referring to the wording related to the predictability of an autonomous weapon or otherwise incorporated as restrictions on other autonomous weapon systems . And this is particularly relevant to the bullet on the second page that talks of limiting types of targets , duration , geographic scope and scale of use . We will not go into detail on these points here and instead we refer back to and rely on our previous interventions and recommendations but just to emphasize that in our view it is crucial that these prohibitions and restrictions be enshrined in legally binding international rules in order to provide certainty and clarity and also to address wider humanitarian risks and ethical concerns . No doubt these rules could be complemented and reinforced by common policy standards and good practice guidance but those kinds of measures can not be a substitute for clear binding new law . Thank you , Chair .",Non-applicable,No
AUSTRIA,17:08:21,2024-03-06,0:03:18,"Also we want to share some of our views on the list and on the proposed risk mitigation measures . I think also here we have to do a little bit of boxing , take the different measures that we are having here and think a little bit about where do they fit and what do we do with them . Many of them are quite interesting , quite useful with the big disclaimer and I think this is highly important and cannot be stressed often enough that the ICRC has just pointed . We cannot reinterpret or scale down existing international law . This is something we definitely should not do even if we have instruments where not all parties are part of but for most of the obligations that are widely adhered to , especially with the Geneva Conventions , it is extremely important that we do not do something like this . Then also another point that we want to reinforce is also the very valuable point by ICRC . If we go into something and I think this is a very popular risk mitigation measures and also an important one when it comes to implementation of IHL which are the legal reviews , you always have to have a strong set of legality that you test against . If we have the problem as the colleague has pointed out , that there are unclearities or gaps in the existing legal framework , then this has to be filled first . For these legal reviews to be fully effective . Coming back to the list and the different measures that we are seeing here , we also see several of them as part of the prohibitions and regulations that we have already discussed and that we want at least from our Austrian point of view see in a possible instrument . Then we are having some other measures that are quite useful as well that might either be and here we have different options , be part also of national level implementation , could be to some point a recommendation or and this is something we definitely need to discuss , we could also include them in a possible instrument as it has been done in protocol 5 . If colleagues have a look at this , there is a wide range of precautions or other measures that states could take that go broader than the original prohibition that is set out in the protocol . We could include this in the instrument or we could put it into another box . This is something to discuss . What is important for us in the first place is that we have a clear set of prohibitions and regulations first which have been indicated in your first questions and in our discussions also give priority to them . Everything here is mostly everything here is important and useful but it is not the priority in our work at the moment as a final point . Thank you . Thank you for that .",Western European and other States,Yes
