Speaker,Time,Date,Duration,Statement,Region,High Contracting Party
EUROPEAN UNION,16:30:31,2024-03-05,0:02:58,"Thank you , Mr. Chair . Since this is the first time that I take the floor , I would like to congratulate you on the assumption of your duties and assure you that you can rely on the EU full support . The EU remains committed to pursue the efforts in the GGE . We have a view to ensuring that the outcome reflects the necessity of compliance with international law , in particular international humanitarian law taking into account relevant ethical considerations . Let me start with general remarks on the compliance with international humanitarian law and some of them will refer also to the ballots presented on the screen . The EU emphasizes that human beings must make decisions with regard to the use of lethal force , must exert control over lethal autonomous weapon systems that they use and remain accountable for decisions over the use of force in order to ensure compliance with international law , in particular IHL , taking into account ethical considerations . Those who plan , decide upon and carry out an attack using a lethal autonomous weapon system must , therefore , ensure that the weapon system and the way it is used will preserve a human being's ability to make the necessary legal judgments and thereby ensure compliance with international law , including IHL . We support also the reference to the need to ensure that the development , production , deployment and use of emerging technologies in the area of laws must be in compliance with international law , in particular IHL . Also appropriate level of human control and judgment should be retained during the whole life cycle of the weapon system to ensure compliance with international law , in particular IHL . Moreover , the EU supports the so - called two - tiered approach to laws . A distinction should be made between those weapon systems that cannot be used in accordance with international law , in particular IHL , which states should commit not to develop , produce or use and systems that include autonomous features requiring regulation to ensure compliance with IHL and other applicable international law . Let me also make a remark on human responsibility . We recall that states bear a fundamental responsibility to ensure that the development , production , deployment and use of emerging technologies in the area of laws will be in compliance with international law , in particular IHL and that human responsibility for decision on the use of force must be retained . Thank you , Mr. Chair .",Non-applicable,No
RUSSIAN FEDERATION,16:33:43,2024-03-05,0:05:39,"Thank you very much , Distinguished Chair . At the outset , I would like to apologize for having to take the floor once again , second time , but we would like to react to one comment that was made by the Delegation of Germany . A comment about the fact that it is very difficult to see whether lethal autonomous weapon systems are employed in line with IHL because such systems are unpredictable . We , once again , are hearing about this issue of predictability or non-predictability in the GGE as an excuse explaining why this weapon system deserves special attention or a creation of a separate exclusive group for this type of weapon system . We simply do not understand this argument . We are not convinced at all because , in essence , it is not a correct argument using this whole notion of predictability or unpredictability . It is not a legal notion , this notion of predictability . Predictability is insured by relevant norms and principles of international humanitarian law . The relevant understanding on this issue has been enshrined by our group in separate reports and those understandings relate to obligations related to the need to hold legal reviews and to ensure the necessary control and accountability of the designers and those who give orders to use such weapon systems , direct operators of such systems . Moreover , in our last year's report , the GGE referred to specific limitations that can be used for such systems and also to need relevant real training of operators of such systems . All of these measures , measures of precaution , we can call them as such , can ensure the predictability in the use of such weapon systems . This is indeed the objective of the relevant principles and norms of international humanitarian law and the situation here is exactly the same as applied to any other technologically advanced weapon systems and we have dozens of examples of such systems . However , as far as those weapon systems are concerned , we do not see any need to discuss these questions yet in connection with weapon systems with laws , technologies that still do not exist and we are still unable to give a definition of such systems . Now we see that there is some need to place these weapon systems in some type of separate category only because it seems to us that they may be used in an unpredictable manner . So we believe that these arguments are contrived and they remind us of an attempt of setting a task when we know what the answer already is . And this runs counter to the understandings that have already been expressed by the group in order not to inflict any harm or create obstacles to technological progress and to need to thoroughly analyze the existing norms and rules of international humanitarian law and other international legal obligations in the context of weapon systems . Thank you .",Eastern European States,Yes
UNITED KINGDOM,16:39:58,2024-03-05,0:03:20,"Thank you , Mr. Chair . And thank you for sharing this text which goes to the heart of the first element of this debate , that is if we frame this in line with the two - tier approach , what would sit in the first tier . We can see that the discussion ensuing is extremely fruitful in identifying how we should focus our approach . We agree with the sentiment that the framing of this issue could be a little more precise than is currently captured in this text . As we are speaking about compatibility with IHL , we need to look at the long established understanding and practice in relation to the determination of compatibility with the law . We are establishing the starting point here . We need to untangle the intent and the inherent incompatibility from incompatibility that might have an element of use . There is also the question of whether we are in this exercise and in this discussion addressing a pure question of the application of the law as it currently stands or whether we are seeking to extrapolate or even create new law . Bullet point 3 , talking about inherently indiscriminate weapons and bullet point 8 , talking about weapons which cause superfluous injury or unnecessary suffering are incompatible on the basis of the direct application of the law as it stands . The language applying the current law should be careful to translate it properly . Thus we need to look very carefully at the scope of rules , for example , in relation to environmental damage . Bullet points 1 and 2 which refer to meaningful human control and chain of commands are we think an attempt to extrapolate the law . While the final bullet point on attribution concerns the secondary obligations which fall from the requirements to ensure respect and state responsibility . Finally bullet 5 on targeting humans directly does not reflect any existing rule of IHL . There is separate work to be done on whether there is a case to create such a rule and it is clear that the views on that matter differ across this room . We would propose , therefore , that this would be a matter for a discrete area of work should this group deign for that to engage in that potential course . As this particular text risks conflating as such this particular text risks conflating inherent requirements of IHL with the behaviors that enable compliance with it . The Distinguished Delegate from Austria has usefully reminded us that there is scope for this group to both extrapolate and develop international law in this regard . We do not disagree . The elements on this text can be regated into the two - tier approach to do just that . It is using the chapeau in using the chapeau as the US suggests of laws incapable of use in accordance with IHL . We provide a firm category from which to launch the work on the question of necessary human involvement , restrictions on types of target and other regulatory measures as contemplated by the two - tier approach . Thank you , Mr. Chair .",Western European and other States,Yes
BELGIUM,16:43:32,2024-03-05,0:05:11,"Thank you , Mr. President . We would like to point out the core centrality of IHL and international criminal law as it relates to autonomous weapons . This centrality is the core of this discussion in my Delegation's opposition to matters related to these weapons systems . Belgium calls for a two - tier approach , first an explicit ban on certain types of autonomous weapons and the regulation of others such as an increasing number of Delegations within this group of experts have also said . Belgium's understanding of the two - tier approach acknowledges that all autonomous weapons systems are not equal as regards the legal and ethical potential implications by distinguishing systems that should be prohibited from those that should be regulated . The two - tier approach tries to create a more nuanced framework , a more efficient framework to meet the challenges of autonomous weapons systems . Belgium underscores the importance of significant human control on autonomous weapons systems and identifies the interaction between human and machine as essential in guaranteeing compliance with international human law , humanitarian law and international human rights law and international criminal law . Belgium recognizes that the interaction between humans and machines can take different forms and can take place at different stages of the life cycle of a weapon and so the regulatory and operational framework should be based on the process and it depends on the context , including the technical characteristics of the system , of the environment in which this is being used as well as the type of interaction between the human and the machine which should have significant human control . According to Belgium , the two - tier approach is based on a prohibition of autonomous weapons systems focusing on complete prohibition of a system that would be in IHL because it could cause suffering because it has indiscriminate effects or that they were created to cause or we might expect that they cause extended long lasting and serious damage to the natural environment as well as autonomous weapons systems that cannot be used in keeping with IHL . The latter type of weapon includes those who were created or used so as to ensure that their effects are not understood or explained well enough beforehand as well as those that do not have significant human control over their function such as the identification , the selection and the engagement of the target . The regulatory tier of the approach is for all autonomous weapons systems that are not completely prohibited and guarantees compliance with the humanitarian law including IHL and its fundamental principles . The distinction of proportionality and precaution means that we have to have guidelines and clear rules when it comes to requirements for human behavior during the development , the deployment or the use of these systems by focusing on maintaining significant human control but also in terms of responsibility and accountability throughout the entire life cycle . With that in mind , my Delegation supports the following parts . According to my Delegation , a weapon system that meets sub item 3 , 4,5 , 6 , 7 and 8 is by definition a system that is incompatible with IHL regardless of its level of autonomy . Autonomous weapons systems that on the other hand are covered by sub items 1 , 2 and the second part of the 7th item are more specifically related to autonomy and as such more relevant to the debate of the G but my Delegation supports these sub items as well . Lastly , my Delegation supports the item on the bullet point on the legal responsibility that the last one with which in and of itself is not incompatible with IHL but with the state's obligations under international law in broader terms . The state must guarantee accountability for the conception , the development , the deployment and the use of autonomous weapons systems in keeping with their obligations under international law and IHL . My Delegation also highlights the importance of taking into account the guiding principles B and D regarding the developers and manufacturers of these autonomous weapons systems given that the responsibility is on them for the conception and programming stages of an autonomous weapon system . This is particularly relevant for the problems related to the data biases that could affect decision - taking and the ill use of data or improper programming . Thank you .",Western European and other States,Yes
INDIA,16:49:01,2024-03-05,0:01:25,"Thank you , Mr. President . This is a very useful compilation and thank you for putting this up . It provides us a general idea of the spectrum of issues we are dealing with when we approach the question that we are discussing from an IHL perspective . It is also one of the alternatives that is available to us for defining the scope of an instrument that we might consider . We support this approach . I have three points , one general and two specific . The general point is that we have no difficulty in accepting well established principles of IHL . However , our position on the rest will be determined on how the obligations and general commitments of an instrument are framed , that is , as prohibitions or restrictions or positive obligations . The two specific points are with reference to the bullet points number 1 and number 5 . We can take a more positive view of terminology such as human control , meaningful or otherwise , if the related obligation is framed positively . The second specific point is that the reference to targeting humans directly needs to be reconciled with the existing law of distinction and the provisions therein about combatants and civilians . Thank you , Mr. President .",Asia-Pacific States,Yes
SWEDEN,16:50:42,2024-03-05,0:02:54,"The floor is for the Swedish Delegation . Thank you , Mr. Chair . Sweden reiterates that this group has acknowledged that international law , in particular IHL , applies to laws . IHL includes rules and principles that de facto prohibits the use of certain weapons and regulates the use of others . Some Delegations in this room wish to create new rules of IHL for laws . Others wish to clarify how existing IHL applies to laws . In this discussion , we think it is useful to be clear about when we are talking about how we understand current applicable IHL and when we are talking about how we think that the law should develop . Sweden understands that we are under this point discussing how current IHL applies to laws . As mentioned yesterday , we support the two - tier approach indicating that a distinction should be made between those weapons systems that cannot be used in accordance with international law , in particular IHL , and systems that include autonomous features which should be regulated in order to ensure compliance with IHL and other applicable international law . Since we understand that there is wide support in the room for the two - tier approach , it would be interesting also to hear from you , Chair , how you understand the questions on topic 2 , application of IHL to relate to the two - tier approach . We also have a few comments on the proposed bullet points . In line with some other Delegations who have mentioned the first bullet point and the second one as well , which relate to human control , they are acceptable to us as such , but they are not necessarily a part of the IHL . We prefer the wording operating completely outside human control , just for the record . Bullet point 3 is , of course , fine with us , acceptable as well . When it comes to bullet point 4 and bullet point 7 , I believe my Distinguished Colleague from Norway put it very eloquently , there are very good elements in there and they are not necessarily opposing one another , but we wonder if bullet point 6 will not encompass all three of these elements in an easier way . Bullet point 5 , like mentioned by other Delegations as well , goes beyond IHL and would not be necessary in this listing . The other bullet points are acceptable to us as proposed by you in general , but it all kind of boils down to the question how they relate to the different tiers of the discussion . Thank you , Chair .",Western European and other States,Yes
PAKISTAN,16:54:46,2024-03-05,0:06:31,"Thank you , Chair . Chair , on the the questions that you have posed before delving into that , I would like to just add a couple of general comments on the debate that is taking place here . We fully agree with , as you have described , that we would get into the form later on how to formulate these suggestions . At the same time , while taking into account the mandate in the mandate , we have been asked also to look at the existing example of our convention and protocols . So when we are working on different formulations , prohibitions or regulations or compliance with IHL , we have to draw constantly guidance from what is in front of us on that count . So on this topic , we understand that we have heard from this room many voices who consider that the first tier would only revolve around the application of existing IHL when we talk about the two - tier approach . Our understanding is that under this topic , while we are engaging on the subject of how the IHL would apply , that will not be the sole determination of the two - tier approach . The obligations in terms of in both tiers that would be contained therein May have other sources as well other than the application of IHL . So we would reserve the right to come to that at a later stage under other topics which will also contribute to these two tiers . Secondly , on the concept of application of IHL , we understand that this topic has been framed right now , application of IHL , but we very much share the point of view that was expressed by the Distinguished Delegate of Austria as well , that for us , IHL is not a static construct and we believe that one of the core purposes of CCW is the progressive development and continued codification of the international law applicable in armed conflict which is clear in our preambler as well . And this is also the examples that we have pursued while negotiating other protocols of this convention . If simply saying that IHL applies was enough , we would not have needed to deliberate and expand on the obligations relating to other weapon systems , for instance , in Protocol 1 where we talked about the effects of the non-detectable fragments or Protocol 4 in blinding laser weapons where we brought out additional effects of those weapon systems as well . So while some notions that appear on the screen as of now , we may not find those exact terminologies in the existing body of IHL . It does not mean that in order to comply with IHL , they cannot be brought up or they cannot be discussed . On the contrary , we believe that the challenges that have been posed by the IHL , we would need to delve deeper into these terminologies , let's say , predictability , understandability , explainability , traceability , all these concepts that have been discussed time and again in our previous work which are relevant to the applicability of IHL . Then we would like to express our endorsement with most of the principles that you have captured on the screen . In this context , I think human control , element of human control , it is important for our Delegation . In our working paper , we outlined that any weapon system that takes decision on the use of force without human control is something that would lead to incompatibility regarding the application of IHL . But we are also open to the idea of mentioning the meaningful human control , but we could have some additional benefits if we could specify how to arrive at that level of control as suggested by our Austrian colleague earlier in the discussions as well . Then we have some additional suggestions as well that were contained in our working paper . I think that should be considered in our setting here . For instance , a weapon system that is not able to take all feasible precautions to protect civilians and civilian objects during an attack . That is an important rule in the IHL as well . Then another one which causes incidental harm to civilians and civilian objects that exceeds the direct military advantage anticipated . We believe that these two important rules are also they have particular significance in the context of lethal autonomous weapon systems . They could be considered here under this topic . Then lastly on the question of state responsibility and individual responsibility , while we agreed in our guiding principles in 2019 that this responsibility and accountability will hold true in all cases , I think it is time now while we are drafting or attempting to draft elements of an instrument to expand on how to ensure that accountability . We would favor that there should be clear language towards that end that humans should remain responsible for and in control of any weapon systems relating to laws and states would be required to evolve effective oversight and redressal mechanisms for any suspected reported or documented violation . We believe many of the useful concepts were there also when we were negotiating the last year GGE's report . Unfortunately we were not able to capture them all at that time due to paucity of time . Now we have a longer mandate and we need to spell out in greater detail how to achieve that level of accountability and responsibility on this topic . Thank you .",Asia-Pacific States,Yes
