Speaker,Time,Date,Duration,Statement,Region,High Contracting Party
ISRAEL,15:59:21,2024-03-05,0:06:19,"Mr. Chairperson , I thank you for giving me the floor . Our Delegation sincerely appreciates the excellent points , questions and tools presented during these discussions . Our Delegation wishes to share its views on the elements and characteristics that will render laws incompatible with IHL . As we have discussed , this principle point over the years in the issue remains at the very heart of our debate . The Delegation of Israel fully acknowledges the well - known and established limitations imposed on weapons under IHL . First and foremost , there are two general rules that apply to every type of weapon . The prohibition on weapons calculated to cause injury or unnecessary suffering as well as the prohibition on weapons that are inherently indiscriminate , that is , weapons that are incapable of being used discriminately . Consequently , falling into one of these two categories will render a weapon system unlawful per se . This applies also to laws . For this reason , these two general rules ought to be part of our expertise - based discussion which Israel welcomes . We will , however , suggest clarifying the inherently indiscriminate formula to the clearer formula that various states are using in practice of "" incapable of being used in a discriminated manner . "" Another element that was already agreed upon by consensus in previous reports and in the 11 guiding principles refers to weapons which are otherwise incapable of being used with IHL or as the US and Switzerland better frame it , weapons that are incompatible with any other treaty or customary law rule . In the context of laws , this notion will accommodate with other IHL rules that categorically prohibit certain types of weapons such as CCW protocols or other treaties and customary rules as applicable to each state . In our discussions , we should be very careful not to conflate categorical prohibitions with targeting law or other IHL rules , particularly pertaining to the ways weapons are used in specific contexts . This would be wrong both legally and practically . For example , proportionality in attack is by definition a context - dependent as it requires considering the military advantage and the incidental damage to civilians in each and every case . As a context - dependent rule , it would be wrong to frame proportionality as a categorical prohibition In addition , it is critical to distinguish on the one hand between primary rules of IHL including categorical prohibitions of weapons , targeting rules and other legal rules and on the other hand , legal or practical aspects which are not by themselves primarily IHL rules . This includes issues such as control , responsibility , foreseeability , predictability or reliability While some of these concepts have significance in other fields of law such as the law of the state's responsibility or the international criminal law or have a practical meaning in the implementation of IHL , treating them as IHL rules or even framing prohibitions while using them would be wrong on many legal and practical levels . Specifically , with regards with categories involving the term control , human control , it is not a overreaching requirement under the IHL . Moreover , after many years of deliberations , we all know that the meaning of the term control in the current context remains unclear in a matter of debates in both IHL terms and the discussions within this forum . It is not coincidental that the forum agreed last year to include the control element in a positive framing without the qualification of human control , thus allowing a more comprehensive discussion on the necessary human interaction to ensure the compliance with IHL rather than conclusively identifying a level of human interaction that deems a system unlawful per se . This approach encourages a more nuanced exploration , a topic on which we might provide further elaboration in our statement addressing the following question as it might be more pertinent in that context . We are open to further discussion on these concepts , but this needs to be done in the right framework rather than in the context of legal prohibitions . Recognizing that there is a sorry , there is no one size fits all set of requirements for every weapon system , Israel believes that determining the appropriate level of human machine interactions and related subcategories should be approached in a more nuanced manner . I thank you , Mr. Chairperson .",Western European and other States,Yes
JAPAN,16:05:54,2024-03-05,0:02:38,"Thank you , Mr. Chairperson . I would like to make comments on the bullet points that you suggested in terms of incompatibility of IHL . I think the third bullet , inherently indiscriminate and the fourth bullet , distinction , proportionality and precaution and in the eighth bullet unnecessary sufferings . I think those terms are not problematic at all in terms of compatibility , incompatibility of IHL . As for the other bullets , I think we need to have more careful considerations from this point of view and I recognize in particular for the first and the second point , that is regarding the human involvement . Those two points are very important topics in our discussions and I would like to make two points for future discussion on this issue . First , ensuring the involvement of human beings who can be held accountable under IHL is essential for the use of weapon systems in compliance with international law , especially IHL . And the second point is it is important that humans are involved responsibly throughout the weapons life cycle and especially that such weapon systems should be used under the responsibility of the human command and control . Indeed ; there is consensus among many countries on the importance of the elements of human responsibility . I think we believe that it is necessary to deepen the discussion on how to secure these two important points in concrete terms in future discussions . Thank you .",Asia-Pacific States,Yes
FRANCE,16:08:47,2024-03-05,0:03:41,"Thank you , Chair . And we would like to thank you as well for the high quality of the dialogue that you have enabled for these relevant issues that you have proposed which have allowed us to have this rich dialogue . And now in front of us we have the difficult task of finding areas of agreement and disagreements and you have all our supports in this endeavor . Well , to begin I would like to provide some general considerations about the implementation of IHL on the matter at hand . Application of IHL , existing IHL to weapons systems based on emerging technologies in the area of laws is truly at the very heart of our work in this GGE . The first of the 11 guiding principles that we collectively developed points out that international humanitarian law continues to be fully applied to all weapons systems . And so our main goal must be to ensure that the development and the use of future weapons , those using autonomy included , are carried out in full respect of existing IHL . To do that , two key principles that arise from the rules of IHL must guide our work . First , the use of lethal weapons systems that include autonomy must be under human control and accountability in this responsibility must be called on if there is a severe violation of international humanitarian law . And the second principle , we must have appropriate human control guarantees that could take various forms and be applied at all stages of the life cycle of a weapon in order to ensure that the use of future weapons systems including weapons systems using emerging technologies in the area of laws remain in line with international humanitarian law and under responsible human control . In order to ensure that IHL is fully respected , we must ensure that the use of these weapons systems and the human control respect the principles of the distinction of proportionality and precaution considering the particular circumstances that of each attack . And that means maintaining sufficient human control . That means that human control must be the only person responsible for deploying a weapon system based on emerging technologies in the area of laws . Human control must also continue to define and validate the missions that are entrusted to this type of weapon system by defining the spatial framework of use , the temporal framework of use and the appropriate regulations . The appropriate level of human control must be assessed on a case - by - case basis and pursuant to the system being considered in order to ensure effective human control , it will be essential to have proper training and operational skill training to have proper understanding of the operators and the command of the system's capacity , its effects and how it interacts with the environments . Thank you .",Western European and other States,Yes
GERMANY,16:12:37,2024-03-05,0:02:46,"Thank you , Mr. Chair . In the case of a fully autonomous weapon system , it is Germany's view that it cannot be determined whether it can be employed in line with international law because its actions are not predictable . In this particular case , it is already the system as such that is incompatible with international law . We would , therefore , support the first option in the first bullet . With regard to the other bullets , it is fundamental that the weapon system itself can be used in a way that is compatible with the rules of international law , that is in particular that it is capable of complying with the principles of distinction , proportionality and precaution . Furthermore , as any other weapon system , also those weapon systems of concern to us today may not be constructed in such a way as to cause super injury or unnecessary suffering . Finally , indeed , we have to ensure the chains of responsibilities are not lost by the use of autonomous weapon systems . As it is not the laws as such that renders the system incompatible with IHL but its use , we would address the question under which circumstances its use is illegal when we discuss the next sub question . In Germany's view , the use of the system is incompatible with IHL if the system or its effects cannot be directed at a specific military objective , including if it employs a method or means of combat which cannot be directed at a specific military objective , or if it contravenes any other substantial provision of IHL , eg , prohibition of unnecessary suffering and superfluous injury , prohibition to attack persons or the combat . Germany aligns itself with subbullets 3 , 4,6 , 8 and 9 and 10 . It also supports subbullets 2 and 7 which are in our opinion a consequence of the aforementioned rules of IHL . To the extent that meaningful is equivalent of appropriate control , Germany can also support subparagraph 1 in that regard . Allow me to particularly highlight our support for bullet 7 , option 1 , effects cannot be limited , anticipated and controlled as layout in the working paper submitted by France , Germany , Bulgaria , Denmark , Italy , Luxembourg and Norway . By contrast , Germany does not consider laws directed against human beings per se incompatible with IHL as suggested in subbullet 5 . As to subbullet 11 , Germany is not entirely sure what is meant here since precluding is a rather general wording . To us the point of reference is not clear . In any event , Germany agrees that human responsibility for decisions on the use of weapon systems must be retained over the entire life cycle . Thank you .",Western European and other States,Yes
CUBA,16:15:40,2024-03-05,0:03:40,"Thank you , Chair . To address your questions under the application of IHL including the concept of human control , judgment or involvement , we would like to point out the following . For our Delegation we cannot limit the scope of the discussions and curtail it only to IHL . Autonomous weapon systems and semi-autonomous weapon systems must be considered in the context of the observance of international law which means that all and any autonomous weapon that does not meet the provisions of international law including IHL must be banned even before they begin to be developed and used in large scale and to be deployed . This is a preventive approach based on the principle of precaution . Systems that do not guarantee significant human oversight nor do predictability , trustability , traceability , reliability and cannot be explained cannot be developed either . Sir , the use of completely autonomous weapons raises challenges for the fulfillment and the observance of the standards and principles of international law that cannot be guaranteed as these weapons could be used counter to the principles of sovereignty and territorial integrity of states which are enshrined in Article 2 of the United Nations charter . The principle of distinction under IHL demands that human beings that resort to force draw a distinction between those participating in the hostilities and that as such can be attacked and all others including civilians , combatants , persons or to combat and other protected persons with laws this principle cannot be insured . These weapons systems can perpetuate and amplify biases including those that are racial or gender biases depending on the data set that they use as a foundation . As we begin our discussion with a view to highlighting the various elements of an instrument we would like to reiterate our concern over the use of these weapon systems and the dehumanization of conflicts . In our view machines cannot replace the human beings in the most important decisions of war . There must be a prohibition of all those that do not have human control over these aspects . The degree of autonomy and lethality are basic characteristics that ought to guide the prohibition or regulation of autonomous weapons . Qualitative judgments which can only be made by humans are of key importance in the terrain of military operations as they provide greater guarantees and fulfillment of international law and they guarantee the individual responsibility as well as states' responsibilities . For our Delegation the laws that cause unnecessary suffering have indiscriminate effects and can produce generalized long lasting and serious harm to the environment must be prohibited and as such they are not compatible with current IHL . Thank you .",Latin American and Caribbean States,Yes
INTERNATIONAL COMMITTEE FOR ROBOT ARMS CONTROL,16:19:41,2024-03-05,0:01:20,"I will now give the floor to ICRAC . Thank you very much , Chair . ICRAC generally agrees with most of the bullet points which are listed . Just wanted to add one to those points and this is a point on incompatibility with rule 88 of customary international humanitarian law on the right to non-discrimination to repeat again it is incompatibility with rule 88 of customary international humanitarian law on non-discrimination . Rule 88 on customary IHL prohibits adverse distinction in the application of IHL based on race , color , sex , language , religion or belief , political or other opinion , national origin , et cetera . Chair , stakeholders have noted that the development and use of certain laws may exacerbate gender and racial discrimination . It is the submission of ICRAC that such laws would be incompatible with international humanitarian law and this point because it is rarely perhaps conversed is a point that ICRAC emphasizes at this point . Thank you , Chair . I would like to thank you for your intervention .",Non-applicable,No
AUSTRIA,16:21:09,2024-03-05,0:04:16,"We just also wanted to share I am sorry . We just also wanted to share some views on this list . Preliminary I can say that we are fully aware that this is just a listing of answers that you have received your questions and that there are some other questions that go into a similar direction . But at the same time we also have to stress out that this is a little bit of an apples and pears list and especially the chapeau creates some problems . I think some delegations have already pointed to that and I will have to go a little bit longer to explain why . The first thing is what we are doing here , at least in our view , some other delegations might have different views are three different things . First , of course , we look into how existing IHL applies . And this are , of course , the things that are core elements of IHL . We see them up there to some extent , the superfluous injury , unnecessary suffering , distinction proportionality precaution and so on . How do these apply in a context where we have these kind of weapons ? And if we go to this , we also have already quite a common understanding or many delegations are supporting that these kind of weapons that have these problems in their design , in their development and so on when we are speaking about autonomous weapons systems should be prohibited . The problem is this is not the only thing that we are doing here . What we are also looking is how does IHL apply , how can we specify how IHL applies and solve some of the problems and question marks surrounding these kind of weapons . And this is not only a kind of list like this . It is also related to the use . It is also related how those kind of weapon systems are managed , how they are designed and this relates also to issues then like accountability , predictability , reliability and so on . And these are , of course , not core principles of IHL that render a weapon systems incompatible with IHL as such . It is highly related also how it is used in the end . And this is another dimension that we have to look at that is not necessarily fit to be used in such a list . In our view , this also relates to human control . We see human control here as the first point operating completely outside or the absence of meaningful human control . In the essence , we could agree with this . But as the US also has pointed out , it is not very clear as it is . It is not a category of existing IHL . So what we have to do , we have to fill it with substance . And this is , for example , one of the things that we tried to do in our working paper of last year and the result that will hopefully at some point will come to light is that human control has to be built . It has to be achieved by setting specific measures . It is not just there out of the blue . It is not jumping out of the box . You have to do something to achieve human control . And so it also does not really fit under a chapeau like this . And the third thing , and this is also a problem , we are also having kind of prohibitions that are not necessarily derived from IHL . I know that this is not very popular . But it also derives from human rights law , from ethical principles and it can also be completely new law . And before people are completely shocked by this , I want to refer to the preambular of the CCW that clearly reaffirms the need to continue the qualification and progressive development of the rules of international law applicable in armed conflict . And this is also something we could do . We are aware that it is not widely popular , but this is also one of the things that we are doing here . It is also not an application of existing international humanitarian law . And this is kind of the weird situation that we are in here with this list in front of us . Having said this , there are several points that we could agree with , but others are having the specific problem that they need to be specified . They need more context . They need more flesh surrounding it . And in other cases , we just have to put them under a different heading . Sorry for being so direct and thank you . I think I have some other points later on as well . Thank you for those initial comments .",Western European and other States,Yes
ICRC,16:25:39,2024-03-05,0:04:36,"Thank you , Chair , for giving us the floor . In terms of the characteristics that would make an autonomous weapon system incompatible with IHL , on the first bullet point regarding human control , we note that IHL does not necessarily demand human control over the weapon system itself at all stages , but IHL does require control over the weapon's effects . And this concept of human control over effects or over the use of force should underpin the drafting of any instrument . For us , it is what needs to be preserved . And the way to preserve it is to prohibit certain autonomous weapons and restrict all others . Then looking at some of the other bullet points , of course , like any other weapon , autonomous weapon systems will be incompatible with IHL if they do not comply with existing IHL rules that apply to weapons , means and methods of warfare . And I think this is well recognized in a number of bullet points on the screen , explicitly in the second last bullet point , but also in those referring to weapons that are inherently indiscriminate or cause superfluous injury or unnecessary suffering or widespread long term or severe damage to the natural environment . So undoubtedly these elements would make an autonomous weapon system incompatible with IHL compliance , but we consider that the value of this group's discussions lies in moving beyond a restatement of IHL rules to elaborate how these rules and how international law more broadly specifically apply to constrain the development and use of autonomous weapon systems and to identify also where these rules should be strengthened . And I echo the comments just made by Austria in this respect . So in this respect , we find the seventh bullet point particularly helpful . It seeks to translate IHL's requirements into a prohibition on autonomous weapons , the effects of which cannot be understood , predicted and explained . In our view , this wording , it reflects IHL's requirements for weapons users to anticipate and limit and control effects and we note that is alternative wording there . But it would do so in a way that offers more concrete guidance for the design and use of autonomous weapon systems . We think that this kind of formulation would assist in addressing certain types of particularly problematic autonomous weapon systems including those that rely on certain AI or machine learning techniques that lead to the kind of opaque or unpredictable functioning that was noted this afternoon by the Distinguished Delegates of Ireland and Norway or those which change functioning after a review or during use . Chair , considering bullet 5 , referring to autonomous weapon systems designed to target humans directly , we struggle to conceive of an autonomous weapon system like this that would not pose a real risk of IHL violations . As was highlighted earlier by the representative of Ireland , autonomous weapon systems are unlikely to be able to account for all the contextual signals that indicate that a person is protected from attack . We would also like to note that IHL requires preserving a possibility for adversaries to surrender . So employing an autonomous weapon system that would not be capable of identifying an intent to surrender would violate that prohibition on the denial of quarter . Finally , Chair , we note that this topic is focused on IHL but at the same time and similarly to the comments just made by the Distinguished Delegate from Austria , we strongly encourage attention to ethical concerns within this topic because these concerns are at the heart of debates about the acceptability of autonomous weapon systems . Ethics have always been a driver for the evolution of international legal rules in warfare and they should not be viewed as an afterthought . They have been explicitly recognized as a guiding principle for the work of this GGE and their role is reflected in the Martens clause . So the ICRC's view is that ethical concerns arise with all autonomous weapon systems that endanger human beings but they are particularly acute when it comes to autonomous weapon systems that target human beings directly as referred to in bullet 5 . I thank you , Chair .",Non-applicable,No
