Speaker,Time,Date,Duration,Statement,Region,High Contracting Party
SWITZERLAND,17:01:27,2024-03-05,0:05:59,"Thank you very much . Thanks , Mr. President . Like others I would like to thank you for yet another useful list . The starting point for us is that autonomous weapons systems that cannot respect IHL are ipso facto prohibited . The use of other AWS should be regulated notably to ensure that they respect IHL . It is therefore a very pertinent question what elements or characteristics would make an AWS incompatible . So like others have said before us , what we are doing here really is to identify the key components of the first tier , namely what should explicitly be prohibited . Another question was asked previously , what makes AWS so special that we would have to look more closely whether they comply with IHL . Well , we let machines do something that was originally done by human beings and this points to what our Austrian colleague has said before , how the system really is used in the end in the specific situation and it also relates to the words of our US colleague this morning , autonomy can be understood as a way of using it , the system . This is very significant . That is why we are here for ten years now . We have discussed this because it is significant development , significant for the CCW . To the specific bullets , some of the points on the list , they reflect clear and long - standing prohibitions under IHL , namely the prohibition of means and methods of warfare that are of a nature to cause superfluous injury or unnecessary suffering , the prohibition of the use of methods or means of warfare that are intended or may be expected to cause widespread long - term and severe damage to the natural environment , the prohibition of means and methods that are by nature indiscriminate , means and methods of warfare are by nature are those that cannot be directed at a specific military objective or whose effects cannot be limited as required by international humanitarian law and consequently are of a nature to strike military objectives and civilians or civilian objects without distinctions . So bullet 4 and partly bullet 7 could kind of be subsumed under the prohibition of weapons that are by nature indiscriminate . And then following this logic , it would also be incompatible with IHL if its effects cannot be limited , anticipated and controlled in the circumstances of its use , ie , the specific context where or when the system is used . And this would notably be the case if a system was operating completely outside human control or outside a responsible chain of command . And this is supporting points 1 , point 2 , but also most importantly bullet point 7 . This is the key issue at hand and we could not agree more with the ICRC which has referred to this as the added value of our group and the point made by our Pakistani colleague just a moment ago on the progressive codification which is a point we fully support and he made that point very eloquently just now . With regard to point 5 , our design to target humans directly , we would be hesitant to interpret the IHL prohibition so extensively as IHL does not prohibit the targeting of persons as such . IHL is clear , however , that parties to an armed conflict shall direct their operations only against military objectives which includes combatants . It is therefore notably prohibited to target civilians or combatants or the combat . And having said that , an oath designed and used to target humans poses serious questions , in particular regarding the risk of IHL violations . And this may deserve more policy and ethical reflections for an instrument if that instrument would go beyond what is strictly required by IHL . Then last but not least regarding bullet 6 , it is our impression that complying with these principles is rather a question of targeting law , ie , how a weapon is used . Of course , if a system would be designed in a way that it is not possible to direct it at a specific military objective or if it would invariably cause excessive collateral damage , it could be considered to be indiscriminate by nature . So those are some of the points that we wanted to contribute at this stage to this topic . Thank you so much . I would like to thank you for your intervention and your contribution to the discussion .",Western European and other States,Yes
UNITED STATES,17:07:39,2024-03-05,0:10:36,"Mr. Chair , we wanted to really react to the very good discussion today and really appreciate you for facilitating and guiding us towards a very substantive exchange . I think one point that we wanted to agree with was I think just said very well by our distinguished colleague from Pakistan . That we really need to delve deeper on a lot of these concepts and engage in more work . Also wanted to generally endorse Sweden's comment that we should be clear in our work about when we are stating existing law and when we are proposing new new law . That said , we do have some divergences from some of the discussion and we did want to record those . I think a general important principle for us is that people and the users of the weapons are the ones who must comply with IHL and IHL obligations . The weapons do not have legal obligations as such and we hear some people saying that the weapon must comply with IHL and we find this problematic because it seems to articulate requirements that no weapon has ever had to be subject to and it would be then a basis for outlawing many existing weapons . Of course , from our perspective , it does not make sense to interpret IHL to render unlawful many existing weapons that people are currently using without legal controversy . Although we see differences in how people understand IHL to apply , I really do want to emphasize we want to work through those differences by being more specific and granular and talking about how specific rules of IHL apply with regard to the use of weapons with autonomy . We think this specificity will be important for making sure we have consensus on meaning of the elements of the instrument and making sure we have an effective instrument that will can be applied and regulate state behavior . So now I will just proceed with some specific remarks on some of the bullets in addition to what my colleague noted as more general comments earlier . With regard to the bullets operating completely outside / the absence of meaningful human control , I think you know my Delegation's position on this . We would also agree with Austria that this bullet does not really fit here , right ? How you control the weapon system , you know , we see as a function of the use of the weapon and it is not an attribute of making the weapon intrinsically by nature prohibited . So favor moving the discussion on these aspects , you know , to the second tier of talking about use . Another point we would make is that from our perspective , every munition at some point operates outside human control . You know , there is always a point where we are not able to control the effects of a weapon and so we are struggling to understand this point that that would then be a basis for rendering weapon systems to be illegal . A similar point with regard to the next bullet and a responsible chain of command , again we see that as a function of how the system is used and not an attribute of the system . The IHL concept of responsible command and control relates to the people in the armed forces who are using the weapon , not the weapon as such . With regard to the bullet about cannot be directed at a specific military objective / cannot distinguish between military and civilian targets and persons or to combat , one comment we have is to delete specific before military objective . We do not see specific as necessary here and in our view it is consistent with IHL if the weapon can be directed at military objectives . We would object to the notion that the weapon needs to be able to distinguish between military and civilian targets and persons or to combat . No weapon has been able to do this . We think these are obligations incumbent on the users of the weapons to do so . So again , we would modify the language to talk about whether the weapon is capable of being used by a person to conduct an attack consistent with distinction of proportionality rather than having the weapon have to comply with the legal rule . With regard to the bullet about our design to target humans directly , we would agree with the Indian Ambassador's comment on this point . With regard to the bullet incapable of complying with the principles of distinction , proportionality and precaution , I first would like to associate our Delegation with the point that Switzerland just made that we see this language as emanating or connected to the notion of inherently indiscriminate weapons and then would make the same point that we have made that it is not the weapon that must complies with these principles and requirements but instead that the weapon is incapable of being used in accordance with IHL . We would prefer to add principles and requirements here when talking about distinction and proportionality in line with our past GGE language . I think another point we would make substantively here is to omit the notion of precautions and attack . You know , we see precautions and attack as a requirement emanating from the principle of proportionality rather than a freestanding principle . In addition , we have not understood the legal requirement to take precautions in planning and conducting an attack to be a basis for prohibition on a class of weapons . The requirement to take precautions is qualified by what is feasible which is a very contextual analysis and here I think our Distinguished Colleague from Israel made a very good explanation of the point of how some IHL requirements need to be based on the circumstances ruling at the time and we certainly think precautions fits in that category and it is thereby difficult to extrapolate that into a general prohibition on a class of weapons . With regard to the next bullet , effects cannot be limited , anticipated , controlled , et cetera , I think our general comment would be that we do not see these as freestanding requirements of IHL and we would urge that we try and like a colleague from Pakistan delve deeper into some of these requirements and how they connect with specific rules and principles of IHL and I will just illustrate how we have tried to do that in our draft Articles with the language autonomous weapons systems may only be developed such that their effects and attacks are capable of being anticipated and controlled as required in the circumstances of their use by the principles of distinction and proportionality . So we are trying to deal with the same concepts of anticipation and control but we are also trying to be more granular and to connect them with specific IHL rules and that is an approach that we think would be a useful approach to deepen our discussion . With regard to the next bullet , causes superfluous injury or unnecessary suffering , we think it would be very important to add being of a nature to cause here because simply causing superfluous injury or unnecessary suffering is not a basis for the weapon itself to be prohibited per se , rather it has to be of a nature to cause superfluous injury or unnecessary suffering . With regard to the next bullet relating to the natural environment , the US is not a party to the 1977 additional protocol 1 and has objected to assertions that this provision of AP1 relating to the natural environment reflects customary international law . Regarding the next bullet about general incompatibility with any treaty or customary law rule , I think this is a very good concept here . One comment is to insert the word "" applicable "" before "" treaty "" because states have assumed different treaty obligations . And then lastly , with regard to the last point , I think there should be we think there should be further clarification of this bullet . It refers to attribution and we understand the attributability of the conduct to a state or an individual to be different from the legal analysis of whether there is legal responsibility , ie , a violation or wrongful conduct . So recommend further discussion on this last bullet . Thanks so much for bearing through this long intervention , but hopefully it contributes usefully to our discussion . I thank you , Mr. Chair . I would like to thank you for going into detail on the text put on the screen . We have so far three more requests for the floor . Australia , Austria and the IGRAC .",Western European and other States,Yes
AUSTRALIA,17:18:42,2024-03-05,0:01:58,"Thank you , Chair . At the outset , I wanted to reaffirm my appreciation for the way in which you are conducting our meeting . This has been a very productive meeting thus far . We would firstly like to provide some overarching observations on the framing of this question and will engage with the specific points outlined and respond to the views of other Delegations in a further intervention . While we acknowledge many Delegations are seeking new prohibitions or limitations that go beyond existing IHL , clarifying and elaborating how existing IHL applies to laws is critical . My Delegation would endorse the preliminary comments made by the Delegations of the United States , Austria and the UK regarding the framing of this question . It makes sense to start with elaborating types of weapon systems that would be inherently unlawful because they are incapable of complying with IHL . We could then move on to Tier 2 , restrictions applicable to use of all other weapons . We would also fully endorse the suggestion to start with existing consensus language and build on it . Further , when discussing how existing IHL applies to laws , it is important to distinguish the rules and principles of IHL and what might be additional good practices or measures that help enable compliance with IHL . It is also necessary to distinguish those IHL requirements that are primarily applicable to the use of weapon systems and measures to be implemented in the design and development phase . We are still mulling over the specific elements proposed here and with your indulgence we would like to return to these elements in a follow - up intervention . Thank you .",Western European and other States,Yes
AUSTRIA,17:20:51,2024-03-05,0:02:44,"Chair and sorry for taking the floor a second time . We felt that we should clarify some of the elements of our statement from before also with regards to how the discussion has developed which I think is in a very good way . One of the points that have come up now out of the discussion is that this kind of elements that we are seeing here should form the first tier of the two - tier approach . In this we do not agree . There are several elements that should also be included here that are actually on the screen but need a formulation that is I have to reformulate . There was the notion by some Delegations that the first tier should be those kind of elements of IHL that are existing and that cannot be used in the framework of autonomous weapons systems . We believe that there are certain other elements that also should fall in the first tier as part of prohibitions and this should also include meaningful human control . There I have to clarify that what we meant with specifying it and making it a positive obligation is something that is more something that states can do is related to this . So there should be a prohibition . If there is no meaningful human control , it should be prohibited . But we also need to make very clear in possible instrument how this meaningful human control can be achieved , what kind of measures must be taken by states to achieve this so that this is not just an empty shell of a word but that it is actually filled with life and something that states can apply . Otherwise we are getting in the legal problems that actually many Delegations fear when we go into the human control debate . The second point is something that we could also see as a possible part of the first tier is a prohibition based on ethical elements . This might relate to something that you could explain like procedural element on how persons are engaged . This , of course , needs more discussion and it is definitely a difficult discussion . But the first tier and this is the main point of my intervention is not just only an explanation how existing IHL applies . It has much more to it and this is something that needs to be included as well and I think the Pakistani colleague and also our Swiss colleague have made excellent interventions in that regard as well . Thank you for that .",Western European and other States,Yes
INTERNATIONAL COMMITTEE FOR ROBOT ARMS CONTROL,17:23:42,2024-03-05,0:02:51,"Thank you very much again , Chair . My intervention at this point in time is just a reflection on some of the comments that have just been made by the Delegation from the United States . Particularly we agree actually and like this point which has been emphasized that when we are discussing laws it is important to not to use or to use phrases that seem as if , you know , machines bear obligations . On that particular point we really agree with the United States . Nevertheless , there is also something that has been said in this particular regard that we would like to seek clarification where the Delegation noted that there is always a point if I am to quote where we are not able to control the effects of a weapon we have questions regarding to that characterization , especially on the position of existing international humanitarian law . Human control over weapons effects in our understanding is part of the basis of the definition of indiscriminate weapons . For example , the ICRC has made it clear also that in defining what constitutes an indiscriminate weapons there are two criteria that are frequently referred to . Number one , whether the weapon is capable of being targeted or directed at a military objective and number two , whether its effects can be limited or controlled . Indeed , there are various provisions within existing IHL in additional protocol 1 to the Geneva Conventions , for example , if you look at Article 51 , subsection 4 , subsection B , if you look at Article 51 , subsection 4 , subsection C , where the question of controlling the effects of a weapon are emphasized as part of the definition of what constitutes an indiscriminate weapon . The same is contained also in rule 12 of customary international humanitarian law in this regard . And , of course , there have been a number of UN General Assembly resolutions going way back where , for example , the question of uncontrollability of effects of a weapon makes it an indiscriminate weapon . Indeed , as a last point on this , for example , in cases before the International Court of Justice , the nuclear weapons case , various states , some of them were in this meeting were able to emphasize the point again that the question of uncontrollability of effects of a weapon makes it indiscriminate . So the concern here is the idea where we are saying it is not always possible to control effects of a weapon . I do not think at least in our view that is the correct characterization of the current position of the law . I would like to thank you for your intervention .",Non-applicable,No
MEXICO,17:26:42,2024-03-05,0:07:03,"Thank you very much , Chair . And to begin , I would like to express my apologies because due to the very charged disarmament agenda I was unable to be present this morning and I arrived late to this afternoon's session . So I can not offer very interactive comments given that I was unable to listen to all Delegations unfortunately . But I will make a presentation about some of these items from our perspective . I would like to begin by mentioning the seminar report of Christopher Hines , special rapporteur on extrajudicial executions who in 2013 already , and we believe this is still quite relevant for our discussions today , said that autonomous weapon systems raise serious and far reaching concerns for the protection of people and lives in both peace and war . This includes a question about the ways in which they can be programmed in order to meet the IHL requirements as well as the protection standards of life under international human rights law . Obviously , this perspective recognizes the necessary interaction between the IHL system and international human rights law which is backed by its jurisprudence and the impossibility of creating a false division in the way in which they ought to be considered and so for our Delegation , there is no question that any weapon system must be developed , deployed and used in keeping with IHL but also with international human rights law , international criminal law and the law and international responsibility in the UN charter . Though Mexico considers that significant human control is an implicit component in IHL , we also take into account existing differences , those that we have been discussing for a decade . So we appreciate the presentation of your list , the various components and elements that would make laws incompatible with IHL . However , we believe along with ICRC and Austria and others that the goal is not simply to have a list of the prohibitions or general applicable regulations but rather to define the specific relevant aspects to ensure that its implementation is compatible bearing in mind the specific elements of autonomy . And so in that regard , we agree with the list that reiterates already existing prohibitions of IHL , particularly those that by their nature are prohibited given that they cannot be used in keeping with existing limitations . For example , being unable to distinguish between military and civilian targets , between combatants and civilian population , between active combatants and persons or to combat , those that cause superfluous damage or unnecessary harm or those that have effects that cannot be limited in keeping with the fundamental principles of IHL , specifically on grounds of distinction and proportionality . Ten years of studying this subject has also shown that these prohibitions given autonomous technologies raise some very essential difficulties bearing in mind that these determinations take place in very complicated contexts and differentiated contexts which require a fundamental human assessment . So we agree with Pakistan and others in that regard who say that we need a more subtle approach , one that would identify specific and indispensable elements in order to be able to meet these general obligations . From our standpoint , some of them include that the development and use of autonomous weapons systems that cannot be controlled , I will start again , to prohibit the use and development of autonomous systems that cannot be controlled by humans for which they are limited to cognitive and epistemological limitations in addition to being subjected to different types of bias , for example , those arising from the source of information being employed or algorithmic bias . Two , that the development and use of autonomous weapons systems whose programming allows for the removal of human control over the critical functions related to the selection of targets , the involvement and use of force , the development and use of autonomous weapons systems whose effects do not meet the criteria of predictability and whether it is explainable for the operators . Or four , the development and use of autonomous weapons systems that were not subjected to a legal assessment in keeping with the obligations under Article 36 of the additional protocol 1 in customary law . Now , the simple involvement of a human in the selection operation and the involvement in the use of force does not resolve in and of itself the compatibility risks with IHL given that it seems to not involve some fundamental components of the human component . There must be a guarantee that there are proper understanding of the limitations of their use , even spatial and temporal limitations and a decision that is taken must take place when they know the operational context through a sufficient knowledge of the situational environment . It must take the necessary precautions in carrying out operations in order to ensure that parameters of the mission do not change without human assessment and that it allows for constant oversight to guarantee intervention when needed , particularly in order to interrupt and deactivate the system during the operational stage . And lastly , that the guarantee that human involvement be substantive , not just in name only . Now , all of these are elements that as has been said will require further consideration in future debates . And lastly , we would like to reiterate as we said yesterday when we agree with the ICRC and others on the relevance of the ethical perspective , deontologically speaking and under the criterion of human dignity , which is part and parcel inherently implicit in IHL and international human rights law . Thank you .",Latin American and Caribbean States,Yes
